project_name,github_link,readme_installation_score,readme_quality_score,commit_activity_score,total_score,readme_installation_comments,readme_quality_comments,commit_activity_comments
rodweleo/neuroverse-ai-hub,https://github.com/rodweleo/neuroverse-ai-hub,4,4,2,10,"The README provides two clear installation steps: cloning the repository and installing dependencies. The instructions are concise and easy to follow. However, it would be beneficial to include a brief description of the dependencies required for the project, such as specific Node.js versions or other software requirements. Additionally, it would be helpful to provide information on how to run the project after installation. Despite these minor suggestions, the README provides a good foundation for installation instructions, earning a score of 4.","The README file is generally well-structured and easy to follow. The use of headers and formatting is good, making it easy to navigate the different sections. The language is professional, and the explanations are clear.","Although there was one commit during the hackathon period, the quality of the commit message suggests that it was a meaningful contribution to the project. However, the lack of consistency in development activity and the single commit during the 21-day period indicate that the project's development was not very active during the hackathon."
hothuy19/nootverse,https://github.com/hothuy19/nootverse,5,4,1,10,"The README file provides an excellent installation guide with clear step-by-step instructions. The instructions are concise and easy to follow, and all dependencies are listed. The use of code blocks and clear commands makes it easy for users to understand what to do. Additionally, the README mentions that the application will be available at a specific URL, which helps users know what to expect. Overall, the installation guide is well-written, comprehensive, and easy to follow, earning a score of 5.","The README is well-organized and easy to follow, with clear headings and concise descriptions of the project's features, architecture, and development process. The use of Markdown formatting and emojis adds a touch of personality to the text, making it more engaging to read.",No commits found during hackathon period.
webstriiix/encrypted_notes,https://github.com/webstriiix/encrypted_notes,4,4,1,9,"The README provides a good overview of the project structure and configuration files, as well as some basic commands to get started with the project. It also mentions some external documentation resources for further learning. However, the installation process is not explicitly described in a step-by-step manner. The reader is expected to have some basic knowledge of the Internet Computer development environment and the DFX toolchain. While the README does provide some commands to run the project locally, it does not explicitly list dependencies or prerequisites, making it slightly unclear for new users. Overall, the README is good but could be improved with more detailed installation instructions.","The README file is generally well-structured and easy to follow, with clear headings and concise sections. The language is professional and free of major grammatical errors. The inclusion of links to relevant documentation and the use of code blocks to illustrate commands are effective in providing readers with a comprehensive understanding of the project.",No commits found during hackathon period.
,,0,0,0,0,Error during evaluation: 'float' object has no attribute 'endswith',Error during evaluation: 'float' object has no attribute 'endswith',Error during evaluation: 'float' object has no attribute 'endswith'
duongthai5/myth-mint,https://github.com/duongthai5/myth-mint,4,4,1,9,"The README provides a good attempt at providing installation steps, but could be more detailed. The steps are clear and concise, and the use of code blocks for the command lines is helpful. However, the installation process could be more straightforward, and some dependencies (e.g., what is ""mops install"" for?) are not clearly explained. Additionally, there is no mention of any prerequisites or specific requirements for the environment. Despite these minor issues, the README still provides a good foundation for understanding the installation process, and with some minor tweaks, it could be even more effective.","The README file is well-structured and generally clear, with a logical flow and proper use of headers and formatting. The language is professional, and the explanations are concise and easy to understand. The file provides a good overview of the project, its features, and its technical requirements.","There were only 1 commit during the entire hackathon period, which is a very low number. Furthermore, the commit message is quite generic, indicating that the project was initialized with Git, but there is no indication of actual development or changes made to the project. The lack of commits and the poor quality of the commit message suggest that there was no meaningful development activity during the hackathon period."
web2chains/e-demokrasi-icp,https://github.com/web2chains/e-demokrasi-icp,2,3,1,6,"The README file does not provide clear installation steps, and it does not list dependencies. It only mentions the name of the project, e-Demokrasi app, but does not provide any information on how to install or run it. There are no prerequisites mentioned, and the installation process is not easy to follow. While the file provides a basic overview of the project, it falls short of providing sufficient installation instructions.","The README file has a good start, but it could benefit from some improvements to enhance clarity and structure. The title ""e-Demokrasi app"" is clear, but the introduction is brief and doesn't provide much context about the app's purpose or functionality. The text could be more concise and focused.",No commits found during hackathon period.
jcorrales0620/DeAITH,https://github.com/jcorrales0620/DeAITH,3,4,3,10,"The README provides a basic overview of how to run the project, but the installation steps could be more detailed. The instructions are step-by-step, but some of the commands are not fully explained, and there is no clear separation between the installation and deployment steps. Additionally, the README does not provide a clear list of dependencies, which may cause confusion for new users. Overall, the installation instructions are sufficient, but could be improved with more detail and clarity.","The README is generally well-structured and easy to follow, with a clear and concise introduction to the project. The use of headers and formatting is effective, making it easy to navigate the different sections. The language is professional and technical, which is suitable for a project of this nature.","The project has a total of 5 commits during the hackathon period, which indicates some development activity. However, the quality of the commit messages is not impressive, with only one commit having a meaningful description. The rest of the commits have brief or generic messages. While there are some commits, the consistency of development activity is not evident, as there are gaps in the commit history."
SLSU-Turing-Machines/Buoy-Agent,https://github.com/SLSU-Turing-Machines/Buoy-Agent,4,4,1,9,"The README provides clear installation steps, but could be more detailed. The step is to ensure Python 3.10.11 is used and then install the required dependencies using `pip install -r requirements.txt`. While this is sufficient, it would be helpful to have a brief explanation of what `requirements.txt` contains and why it's necessary. Additionally, it would be good to include any specific configuration or setup requirements for the project. Overall, the installation steps are straightforward, but a bit more context would make the process even easier to follow.","The README file is generally clear and well-organized, making it easy to follow along. The use of headers and formatting is effective in breaking up the content into logical sections. The language is professional, and the explanations are concise.",No commits found during hackathon period.
,,0,0,0,0,Error during evaluation: 'float' object has no attribute 'endswith',Error during evaluation: 'float' object has no attribute 'endswith',Error during evaluation: 'float' object has no attribute 'endswith'
SpaceCoupe55/LastPing,https://github.com/SpaceCoupe55/LastPing,4,4,2,10,"The README provides a good overview of the project and its components, but I would like to see more detailed installation steps. The steps are broken down into two main sections: deploying from ICP Ninja and building and deploying from the command-line. The command-line instructions are provided, but they assume some basic knowledge of the IC SDK and its commands. Additionally, there is no explicit mention of prerequisites or dependencies, which could be helpful for users who are new to the project.","The README file is generally clear and well-organized, making it easy to follow along. The use of headers and formatting is good, with clear section breaks and concise headings. The language is professional, and the explanations are clear and concise.","The project has a total of 15 commits during the hackathon period, which is a decent number. However, the recent commit messages show that most of the commits are repetitive and don't provide much insight into the development activity. There is no indication of meaningful commits or significant development progress. The consistency of development activity is also lacking, as there is no clear pattern of commits throughout the hackathon period. Overall, the commit activity is not impressive, and the score reflects a ""Poor"" level of activity."
,,0,0,0,0,Error during evaluation: 'float' object has no attribute 'endswith',Error during evaluation: 'float' object has no attribute 'endswith',Error during evaluation: 'float' object has no attribute 'endswith'
sambutracy/ForecastLive,https://github.com/sambutracy/ForecastLive,4,4,3,11,"The README file provides clear and concise installation steps, making it easy to follow along. The steps are well-organized and include necessary commands to clone the repository, install frontend dependencies, start the development server, and visit the app. However, it would be beneficial to include a brief overview of the prerequisites (e.g., Node.js, npm, etc.) and any specific dependencies required for the project. Additionally, it would be nice to have a brief description of each step to help users understand what they are accomplishing at each stage. Nevertheless, the installation instructions are clear and easy to follow, making it a good starting point.","The README file is generally well-organized and easy to follow. The use of headers and subheaders helps to break up the content into manageable sections. The technical writing is clear, and the language is professional. The formatting is consistent, and the code snippets are properly indented and highlighted.","The project has a total of 4 commits during the hackathon period, which is a decent amount of activity. The commit messages suggest that the development was focused on updating dependencies, refactoring authentication logic, and implementing code changes to enhance functionality and performance. However, the commits are not extremely frequent, and there is a significant gap between the initial commit and the subsequent ones. The quality of commit messages is good, providing a brief description of the changes made. Overall, the development activity is fair, but could be more active to demonstrate a stronger commitment to the project during the hackathon period."
https://github.com/pixel-land-btc,https://github.com/pixel-land-btc,0,0,0,0,Error during evaluation: list index out of range,Error during evaluation: list index out of range,Error during evaluation: list index out of range
https://github.com/ihimanshu-tech,https://github.com/ihimanshu-tech,0,0,0,0,Error during evaluation: list index out of range,Error during evaluation: list index out of range,Error during evaluation: list index out of range
,,0,0,0,0,Error during evaluation: 'float' object has no attribute 'endswith',Error during evaluation: 'float' object has no attribute 'endswith',Error during evaluation: 'float' object has no attribute 'endswith'
Sipaling-SKS/resumid,https://github.com/Sipaling-SKS/resumid,4,4,3,11,"The README provides a clear overview of the project's features, technologies used, and prerequisites. The installation steps are present, but could be more detailed. The README starts by providing a high-level overview of the project and its features, which is helpful for understanding the project's scope. The prerequisites section is also well-organized and easy to follow. However, the installation steps could be more detailed and step-by-step. For example, the README assumes that the reader has already installed the IC SDK (DFX) and Node.js, but it does not provide explicit instructions for doing so. Additionally, some commands, such as `dfx start --background` and `npm start`, are given without explanations, which may be confusing for readers who are new to the project. Overall, the README provides a good foundation for installation, but could benefit from more detailed and explicit instructions.","The README file is well-structured and easy to follow, with clear headings and subheadings that guide the reader through the project. The language used is professional, and the tone is informative. However, there are some minor issues that detract from the overall clarity and structure.","The project has a total of 2 commits during the hackathon period, which is a relatively low number. However, the commit messages suggest that the commits are meaningful and show actual project development. The recent commit messages indicate that the project is focusing on integrating Gemini services and fixing legacy code issues. While the number of commits is low, the quality of the commits is decent. There is no clear pattern of consistent development activity, but the project is showing some progress. Overall, the project's commit activity is fair, but could be more active with more frequent and meaningful commits."
,,0,0,0,0,Error during evaluation: 'float' object has no attribute 'endswith',Error during evaluation: 'float' object has no attribute 'endswith',Error during evaluation: 'float' object has no attribute 'endswith'
JohnBenJB/DAppStore,https://github.com/JohnBenJB/DAppStore,3,4,2,9,"The README provides a basic overview of how to get started with the project, but it could be more detailed and step-by-step. The instructions are clear and easy to follow, but they only cover the high-level steps of cloning the repository, installing frontend dependencies, and running the local dev server. The README does not provide detailed instructions on how to deploy the canisters, which seems to be a crucial step in setting up the project. Additionally, there is no mention of any prerequisites or dependencies beyond the frontend dependencies. To improve the installation instructions, I would suggest breaking down the steps into more detail, such as providing specific commands for deploying the canisters and listing all required dependencies.","Overall, this README is well-structured and easy to navigate. The use of headers, bold text, and icons adds visual appeal and breaks up the content into manageable sections. The project description is clear and concise, providing a good overview of the DAppStore's purpose and features.","The project has a total of 4 commits during the hackathon period, which is a relatively low number. The commit messages suggest that the project is still in its initial setup phase, with two commits related to setting up the directory structure and one commit to updating the README.md file. The lack of meaningful commits throughout the hackathon period indicates that the project is not showing significant development. While the consistency of development activity is not an issue since all commits are from the same period, the overall quality of the commits is not impressive. Therefore, I would assign a score of 2, indicating poor commit activity."
,,0,0,0,0,Error during evaluation: 'float' object has no attribute 'endswith',Error during evaluation: 'float' object has no attribute 'endswith',Error during evaluation: 'float' object has no attribute 'endswith'
,,0,0,0,0,Error during evaluation: 'float' object has no attribute 'endswith',Error during evaluation: 'float' object has no attribute 'endswith',Error during evaluation: 'float' object has no attribute 'endswith'
marfgold1/WHCL-2025,https://github.com/marfgold1/WHCL-2025,4,4,3,11,"The README provides a good overview of the installation process, including steps for installing the IC SDK and mops, as well as instructions for setting up the project locally. The instructions are clear and easy to follow, and the dependencies are listed. However, there are a few areas where the instructions could be more detailed. For example, the instructions for running the project locally are concise but could benefit from a bit more explanation. Additionally, the instructions for FE integration could be more explicit about the specific steps required to import the BE interface and use it in the FE code. Overall, the README provides a good foundation for installation, but could benefit from a bit more detail and clarity in certain areas.","The README is generally well-structured and easy to follow. The introduction provides a clear overview of the project and its purpose. The sections are logically organized, with clear headings and concise summaries. The use of links to external documentation and guides is helpful for readers who want to learn more.","The project has a moderate number of commits (29) during the hackathon period. The recent commit messages suggest that the developer is working on fixing issues, refactoring code, and making progress on the project. However, the commit messages are not extremely detailed, which prevents me from giving a higher score. Additionally, there is no clear indication of a consistent development schedule, as the commits seem to be scattered throughout the period. Overall, the project shows some development activity, but it could be more consistent and meaningful."
icekidtech/hyv.icp,https://github.com/icekidtech/hyv.icp,4,4,4,12,"The README provides a good overview of how to get started with the `hyv` project, including instructions on how to explore the project directory structure, default configuration file, and how to run the project locally. The README also provides a list of dependencies and tools required to develop the project, including `dfx`, `npm`, and `Motoko Programming Language`. The installation steps are clear and easy to follow, but some details are missing. For example, there is no clear mention of how to install `dfx` or `npm`, and some commands are not explained in detail. Additionally, the README assumes some prior knowledge of the Internet Computer development community and its tools, which may make it difficult for new users to understand. Overall, the README is well-organized and provides a good starting point for developers familiar with the Internet Computer ecosystem, but it could be improved with more detailed installation instructions and explanations.","The README file is generally well-structured and clear, with good formatting and use of headers. The introduction provides a good overview of the project and its purpose, and the subsequent sections provide detailed information on how to get started and what the project is capable of.","The project shows a decent commit activity during the hackathon period with a total of 19 commits. The recent commit messages indicate that the team has been actively working on the project, with commits related to enhancing the model marketplace, refactor frontend components, and implementing new features. The quality of commit messages is also good, providing a clear description of the changes made. Although the commit activity is not extremely high, it shows a consistent development pace throughout the hackathon period. This suggests that the team has made significant progress on the project during this time."
IC-DAPPS/BitcoinUSTbills,https://github.com/IC-DAPPS/BitcoinUSTbills,3,4,3,10,"The README provides a basic overview of how to run the project, but it lacks clear step-by-step installation instructions. The `dfx start`, `dfx deploy`, and `dfx generate` commands are mentioned, but there is no explanation of what these commands do or how to use them. Additionally, the README assumes that the reader already has Rust and dfx installed, which may not be the case for all users. While the README is well-organized and provides a good overview of the project, it could benefit from more detailed installation instructions to make it easier for new users to get started.","The README file is well-organized and covers all the essential topics related to the project. The use of headers and formatting is excellent, making it easy to navigate and understand. The language is professional, and the explanations are clear. However, there are a few minor issues that prevent it from scoring a 5. For example, there are a few grammatical errors and some redundant information that could be omitted. Additionally, some sections, such as the "" Architecture"" section, could be more concise and focused on the most important details.","The project has a total of 5 commits during the hackathon period, which is a reasonable number. However, the quality of the commit messages is quite varied. Some commits seem to be focused on updating dependencies or renaming the project, which are important but not necessarily indicative of active development. Others, such as the setup commit, are more minor. While there is no clear pattern of consistent development activity, the commits do suggest that the project is being worked on. Overall, while the commit activity is not outstanding, it is sufficient to warrant a score of 3."
https://github.com/mugivarich7,https://github.com/mugivarich7,0,0,0,0,Error during evaluation: list index out of range,Error during evaluation: list index out of range,Error during evaluation: list index out of range
poggufanz/dao-tools,https://github.com/poggufanz/dao-tools,2,4,3,9,"The README file does not provide clear installation steps for installing and running the OpenVote project. While it provides an overview of the project's features, vision, and technical stack, it does not provide a step-by-step guide for setting up and running the project. The file mentions that screenshots and a demo video are coming soon, but this does not provide any information on how to install and run the project.","The README file is generally clear and well-organized, with a logical structure and good use of headers and formatting. The language is professional, and the explanations are concise and easy to understand. However, there are a few minor issues that prevent it from being a perfect 5.","There were 5 commits during the hackathon period, which is a decent amount of activity. However, the commit messages suggest that most of the commits were minor updates (e.g., updating README.md) or initial setup (Initial commit.). While there is some development activity, it's not consistently meaningful. The only commit that suggests actual project development is the one related to the frontend and backend (feat: frontend (next.js) and backend (mokoto) | 20/07). Overall, the development activity is fair, but could be more active and meaningful throughout the hackathon period."
,,0,0,0,0,Error during evaluation: 'float' object has no attribute 'endswith',Error during evaluation: 'float' object has no attribute 'endswith',Error during evaluation: 'float' object has no attribute 'endswith'
Vishma333/JEEVPATH,https://github.com/Vishma333/JEEVPATH.git,2,2,2,6,"The README file does not provide clear installation steps. It only has a title ""JEEVPATH"" and no further information about how to install the project. There are no dependencies listed, prerequisites mentioned, or step-by-step installation instructions. The file is completely vague and unclear, and it does not provide any guidance on how to get started with the project.","The README file is lacking in clarity and structure. The title ""# JEEVPATH"" is not descriptive or informative, and it's not clear what the project is about or what the reader can expect to learn from the file. The file consists of a single heading with no content, which makes it difficult to assess the project's purpose, functionality, or usage.","There were only 2 commits during the entire hackathon period, which is a very low number. The commit messages are also not very informative, with only one commit message indicating the initial setup of the project and the other suggesting the addition of files via upload. This lack of detail and the infrequent commits suggest that there was very little development activity during the hackathon period."
