project_name,github_link,readme_installation_score,readme_quality_score,commit_activity_score,total_score,readme_installation_comments,readme_quality_comments,commit_activity_comments
jakepeg/canister_app,https://github.com/jakepeg/canister_app,4,4,1,9,"The README provides clear installation steps for running the dApp locally, including commands for starting the Internet Computer backend, installing frontend dependencies, and deploying the canisters. The instructions are concise and easy to follow. However, the README could be improved by providing more detail on the prerequisites and dependencies required for the installation process. For example, it would be helpful to specify the exact versions of Rust, Svelte, and TailwindCSS required for the project. Additionally, the README could benefit from a summary of the installation process at the top, providing an overview of the steps involved in getting the dApp up and running. Overall, the installation instructions are good, but could be more detailed and user-friendly.","The README file is generally well-organized and easy to follow. The use of headers (# Canister Cloud, ## Features, etc.) effectively breaks up the content into logical sections. The explanations of the project's features and technology stack are clear and concise.",No commits found during hackathon period.
https://github.com/OneWpOrg,https://github.com/OneWpOrg,0,0,0,0,Error during evaluation: list index out of range,Error during evaluation: list index out of range,Error during evaluation: list index out of range
hoanletien/ez-yield,https://github.com/hoanletien/ez-yield,4,4,1,9,"The README provides a good overview of the project and its components, including the commands to run the project locally and start the replica. The instructions are clear and easy to follow, but could be more detailed in some areas. For example, the README assumes that the reader is familiar with the `dfx` command and its options, which may not be the case for all users. Additionally, the README does not explicitly list the dependencies required to run the project, which could be helpful for users who are new to the project. Overall, the README provides a good starting point for users who are familiar with the project's components and tools, but may require additional clarification for users who are new to the project.","The README file is generally clear and well-organized, with a good structure that flows logically from introduction to getting started to running the project locally. The use of headers and formatting is good, making it easy to scan and navigate.",No commits found during hackathon period.
AmariahAK/commit-checker,https://github.com/AmariahAK/commit-checker,4,4,4,12,"The README provides a comprehensive overview of the project's features, usage, and setup experience. The installation steps are presented in a clear and concise manner, with five different methods to choose from (safe installation, manual download, direct pipe, run without installation, and traditional pip install). However, the installation steps could be further detailed, especially for Method 1 (Safe Installation).","Overall, the README file is well-structured and clear, making it easy to understand the project's features, installation process, and usage. The use of headers, emojis, and formatting is effective in breaking up the content and making it visually appealing.","The project has a decent amount of commits (39) during the hackathon period, which indicates a reasonable level of development activity. The recent commit messages suggest that the development has been focused on meaningful tasks, such as releasing new versions of the project, adding new features, and improving the update system. While the commit messages could be more concise and descriptive, they generally provide a good idea of what changes were made. The consistency of development activity is also evident, with commits spread out over the entire hackathon period. Overall, the project's commit activity is good, but could be improved with more detailed commit messages and a focus on smaller, more frequent commits."
levietkhoa4/proof-rate,https://github.com/levietkhoa4/proof-rate,4,4,1,9,"The README file provides a clear and step-by-step installation guide for the project. The instructions are easy to follow, and the dependencies are clearly listed. The guide covers cloning the repository, installing dependencies, starting the local replica, deploying canisters, and starting the development server. The final step is to navigate to a specific URL in the browser to open the application. The only area for improvement is that the guide could be more detailed, especially for users who are new to the technology or unfamiliar with the commands. Additionally, it would be helpful to include any prerequisites, such as specific versions of software or dependencies required. Overall, the README file provides a good installation guide, but could be improved with more detail and clarity.","The README file provides a clear overview of the ProofRate project, its features, and its technology stack. The structure is generally logical, with clear headings and subheadings that help the reader navigate the content. The writing is professional and concise, with minimal grammatical errors.",No commits found during hackathon period.
dikaproject/Icp-Project,https://github.com/dikaproject/Icp-Project,4,4,4,12,"The README provides clear step-by-step installation instructions for the project. The instructions are well-organized and easy to follow, with each step clearly labeled and including the necessary commands to execute. The dependencies are also listed, including Rust, wasm32, and npm, which is helpful for users who may not be familiar with these tools. The only area for improvement is that the instructions could be more detailed, particularly in steps 2 and 3, where the user is expected to install Rust and DFX. Providing more information on how to troubleshoot potential issues or provide additional context for these steps would make the installation process even more seamless.","The README file is well-structured and easy to follow, with clear headings and concise descriptions. The use of headers, formatting, and emojis adds a touch of professionalism and visual appeal. The writers have done a good job of breaking down complex technical concepts into simpler language, making it accessible to a wide audience.","The project has a decent number of commits (12) during the hackathon period, indicating some level of development activity. The recent commit messages suggest that the development team is working on meaningful tasks, such as updating the package.json, implementing immutable logic, and revising fallbacks. The commit messages are also descriptive and provide a good indication of what changes were made. However, the commit activity is not extremely active, and there are some gaps between the commits. Overall, the project shows good development activity, but could be more consistent."
GeeksOfGurukul/Decentralised-voting-system-using-ICP,https://github.com/GeeksOfGurukul/Decentralised-voting-system-using-ICP,4,4,1,9,"The README provides a good overview of the installation process, including step-by-step commands for running the project locally and deploying canisters to the replica. The instructions are clear and easy to follow, and the commands are well-documented with explanations. However, the README could be improved by providing a more detailed introduction to the project structure and configuration file, as well as listing all dependencies explicitly. Additionally, there is no information on how to install the Motoko Programming Language or the SDK Developer Tools, which are mentioned in the documentation links. Overall, the installation instructions are good, but could be more comprehensive.","The README file is generally clear and well-organized, making it easy to follow along. The use of headers and formatting is good, with clear section divisions and concise headings. The language is professional and free of major grammatical errors.",No commits found during hackathon period.
,,0,0,0,0,Error during evaluation: 'float' object has no attribute 'endswith',Error during evaluation: 'float' object has no attribute 'endswith',Error during evaluation: 'float' object has no attribute 'endswith'
M-Salman-khan/Med_Reminder,https://github.com/M-Salman-khan/Med_Reminder,4,4,1,9,"The README provides a good overview of the project, including its theme, problem statement, solution overview, and features. However, the installation steps could be more detailed. The prerequisites (Node.js and npm) are clearly mentioned, and the steps to clone the repository, install dependencies, and run the app are provided. However, the instructions could be more explicit, such as specifying the exact command to run the app (e.g., `npm start` instead of `npm run dev`) and providing any additional configuration or setup required.","The README file is generally well-structured and easy to follow. The use of headers and formatting is good, and the content is concise and to the point. The project's theme, problem statement, solution overview, and features are clearly explained. The setup steps and instructions for usage are also clear and easy to understand.",No commits found during hackathon period.
OfficeXApp/canisters-official,https://github.com/OfficeXApp/canisters-official,4,3,3,10,"The README provides a detailed guide for installing and setting up the OfficeX Drive Canisters project. The installation steps are well-organized and easy to follow, with clear instructions for installing dependencies such as dfx, nodejs, and rust. The README also includes specific commands for creating and deploying canisters, as well as upgrading and updating canisters.","The README file has some good elements, such as the inclusion of a brief introduction, clear headings, and step-by-step instructions for getting started and deploying the OfficeX Drive Canisters. However, there are some areas that could be improved to enhance clarity and structure.","The project has a total of 5 commits during the hackathon period, which is a decent amount. However, the commit messages suggest that the commits are mostly related to refactoring and cleaning up the codebase, rather than actual new development. While the commit messages are clear and descriptive, there is no clear indication of new features or significant changes being made. The development activity seems to be sporadic, with no consistent pattern of commits throughout the hackathon period. Overall, the project's commit activity is fair, but could be more active and focused on actual development."
,,0,0,0,0,Error during evaluation: 'float' object has no attribute 'endswith',Error during evaluation: 'float' object has no attribute 'endswith',Error during evaluation: 'float' object has no attribute 'endswith'
nguyenminhkhai98/chrono-x,https://github.com/nguyenminhkhai98/chrono-x,3,0,1,4,"The README provides a basic overview of how to install and run the project, but it could be more detailed and step-by-step. The instructions mention installing dependencies using pip, but it would be helpful to specify the exact package names and versions required. Additionally, there is no mention of any system prerequisites or specific environment requirements. Overall, the README provides a good starting point, but could be improved with more explicit and detailed installation instructions.",No quality assessment provided.,No commits found during hackathon period.
https://github.com/cGzzzzzz,https://github.com/cGzzzzzz,0,0,0,0,Error during evaluation: list index out of range,Error during evaluation: list index out of range,Error during evaluation: list index out of range
trieuvinhky/meta-poem,https://github.com/trieuvinhky/meta-poem,4,4,1,9,"The README provides a clear outline of the installation process, with step-by-step instructions for cloning the repository, installing dependencies, starting the local replica, deploying canisters, and starting the development server. The instructions are easy to follow, and the use of code blocks helps to make the process more concrete. However, some minor details could be added to make the installation process even more straightforward. For example, the README could specify which dependencies need to be installed, or provide more information about the prerequisites for running the project. Additionally, the README could benefit from a brief overview of the project and its purpose, to give readers a better understanding of what they're installing. Overall, the README provides a good foundation for installation, but could be improved with a bit more detail and context.","The README file is well-organized and easy to follow, with clear headings and subheadings that help the reader navigate the content. The grammar and spelling are generally correct, with only minor errors (e.g., missing articles, inconsistent verb tenses). The explanations are clear and concise, and the use of formatting (e.g., bold text, code blocks) helps to emphasize important information.",No commits found during hackathon period.
humandebri/spotquest,https://github.com/humandebri/spotquest,2,4,4,10,"This README file provides a comprehensive overview of the SpotQuest project, including its vision, mission, game mechanics, scoring system, token economy, technical architecture, and mobile-first development approach. However, it lacks clear installation steps. There is no section dedicated to ""Getting Started"" or ""Installation"" that would guide the reader on how to set up and run the project.","The README file is generally well-structured and easy to follow. The use of headers, subheadings, and formatting is effective in breaking down the content into logical sections. The language is professional, and the tone is engaging. However, there are some minor issues that prevent me from giving it a perfect score.","The project had a decent number of commits (29) during the hackathon period, which indicates a good level of development activity. The recent commit messages also suggest that the team was actively working on the project, with a focus on integrating Expo, updating URL redirects, and improving the II authentication flow. The commit messages are detailed and provide context about the changes made, which is a positive sign."
,,0,0,0,0,Error during evaluation: 'float' object has no attribute 'endswith',Error during evaluation: 'float' object has no attribute 'endswith',Error during evaluation: 'float' object has no attribute 'endswith'
JBL-987/Be-Finder,https://github.com/JBL-987/Be-Finder.git,4,4,3,11,"The README file provides a good overview of how to deploy the project from ICP Ninja and from the command-line. The steps are clear and easy to follow, and the dependencies are listed (IC SDK). However, the installation steps could be more detailed, particularly in the command-line deployment section. For example, it would be helpful to have more information on what to do after running the command, such as what files to look for or what to expect during the deployment process. Additionally, it would be beneficial to have a brief summary of the prerequisites, such as the need to have the IC SDK installed, at the beginning of the README. Overall, the README is good, but could be improved with some additional details.","The README file is generally clear and well-organized, with a logical structure and flow. The use of headers and formatting is good, making it easy to navigate and understand the content. However, there are a few minor issues that prevent it from being excellent.","The project has a moderate number of commits (18) during the hackathon period, which suggests some development activity. However, the recent commit messages are repetitive and mostly related to ""ICP.Ninja export"", which might indicate that most of the work is focused on a specific feature or export functionality. While this is still useful development, the lack of diverse commit messages and the repetitive nature of the recent commits suggest that the development activity could be more varied and meaningful. Overall, the commit activity is fair, but could be more active and diverse."
thanhba664/realty-net,https://github.com/thanhba664/realty-net,4,4,1,9,"The README file provides clear step-by-step installation instructions, which is a significant strength. The steps are well-organized, and each command is clearly labeled and indented correctly, making it easy to follow along. The dependencies are also listed, including the installation of the necessary packages using `npm install`. However, there are a few areas where the instructions could be improved. For example, the README could benefit from a brief explanation of what each command does, especially for non-experts. Additionally, there is no mention of any prerequisites, such as specific software or hardware requirements. Overall, the installation instructions are good, but could be made more comprehensive with additional details.","The README file is generally well-structured and easy to follow. It provides a clear overview of the project, including its goals, usage, and structure. The use of headers and formatting is effective in breaking up the content into manageable sections.",No commits found during hackathon period.
,,0,0,0,0,Error during evaluation: 'float' object has no attribute 'endswith',Error during evaluation: 'float' object has no attribute 'endswith',Error during evaluation: 'float' object has no attribute 'endswith'
diwanmuhamad/neuronet-dao,https://github.com/diwanmuhamad/neuronet-dao,4,4,4,12,"The README provides clear step-by-step installation instructions for running the backend canister. The prerequisites are listed, and the installation process is easy to follow. The instructions are detailed enough to guide the reader through the process of starting the local IC replica, deploying the backend canister, and interacting with the canister. However, the instructions could be more detailed in certain areas, such as specifying the exact directory where the project root is located. Additionally, there is no mention of how to set up the frontend, which might be a crucial part of the project. Overall, the README provides a good foundation for installation instructions, but could benefit from some minor improvements.","The README file is well-structured and clear, with a logical flow that guides the reader through the steps to run the backend canister. The use of headers and formatting is effective in breaking up the content into manageable sections. The grammar and spelling are generally good, with only a few minor errors (e.g., ""for frontend, if you want to run both"" is a bit unclear).","Although the total number of commits during the hackathon period is 11, which is a moderate activity, the quality of commit messages suggests that the development activity has been focused on meaningful updates. The recent commit messages indicate that the team has been working on specific features and functionalities, such as updating the backend and UI, adding a license page, and updating the field. This suggests that the team has been actively developing the project throughout the hackathon period. However, the consistency of development activity could be improved, as the commits are not spread evenly throughout the period. Overall, the score is 4 as the team has shown good development activity, but could have been more consistent."
bvsbharat/ATAN,https://github.com/bvsbharat/ATAN.git,2,4,1,7,"The README provides a high-level overview of the project's architecture, core components, and functionality, but it does not include clear installation steps or dependencies. The architecture diagram and component descriptions are useful for understanding the project's structure and features, but they do not provide a clear guide for setting up and running the project. To improve the README, the author could add a separate section or section within the ""Overview"" or ""Getting Started"" section that provides step-by-step installation instructions, lists dependencies, and mentions any prerequisites.","The README file is generally well-structured and clear, with a good use of headers and formatting. The diagrams and architecture overview are particularly helpful in providing a high-level understanding of the system. The language used is professional, and the technical terms are defined where necessary.",No commits found during hackathon period.
,,0,0,0,0,Error during evaluation: 'float' object has no attribute 'endswith',Error during evaluation: 'float' object has no attribute 'endswith',Error during evaluation: 'float' object has no attribute 'endswith'
Oansa/Celestial,https://github.com/Oansa/Celestial,2,2,3,7,"The README file does not provide clear installation steps. There is no step-by-step guide on how to install the project, and it only has a title ""# Astronaut-Assist"". It does not mention any dependencies, prerequisites, or specific instructions on how to run the project. While it may provide a basic overview of what the project does, it does not provide sufficient information for a user to successfully install and run the project.","The README file has some good elements, but it falls short in terms of clarity and structure. The title ""# Astronaut-Assist"" is not descriptive enough to give an idea of what the project is about. The text is not broken up into clear sections or subheadings, making it difficult to navigate. The writing itself is simple and concise, but there are some grammatical errors (""Task:"" should be ""Tasks:"" to match the plural noun ""README Content""). Additionally, the text could benefit from more descriptive language and explanations to help readers understand the purpose and functionality of the project. Overall, while the file is not poorly written, it could use significant improvements to become more user-friendly and effective.","The project had 4 commits during the hackathon period, which is a decent amount. However, the quality of the commit messages is not very informative, with only one commit message providing some context (""Third commit""). The other commit messages are just file names or duplicate messages (""Initial commit""). This suggests that the commits may not be showing significant development activity. Overall, the commit activity is somewhat consistent, but the quality of the commits and the lack of meaningful commit messages bring the score down to a 3."
khaledzak5/Atos-Fit,https://github.com/khaledzak5/Atos-Fit,4,4,1,9,"The README provides a good overview of the installation process, with clear steps for cloning the repository, installing dependencies, and starting the development server. The instructions are easy to follow, and the use of code blocks for the commands makes it clear what the user needs to do.","The README file is well-organized and easy to follow, with clear headings and subheadings that break down the content into logical sections. The use of bold text, emojis, and ASCII art adds a touch of personality to the file without overwhelming the reader. The language is generally clear, with concise explanations of the project's features and technical stack.",No commits found during hackathon period.
Legatia/Legatia,https://github.com/Legatia/Legatia,4,4,1,9,"The README provides a good overview of the project and its features, and it mentions some of the technical requirements for installation. However, the installation steps are quite concise and don't provide detailed instructions for a complete installation process. The reader would need to follow additional resources, such as the DFX SDK documentation and the Rust installation instructions, to complete the installation. Additionally, the README could benefit from a more explicit step-by-step guide for setting up the project, including any necessary configuration or environment setup. Overall, the README provides a good foundation for installation, but it requires additional resources and some effort from the reader to complete the process.","The README file is generally well-structured and easy to follow. The use of headers, bold text, and emojis adds a touch of personality and makes the content more engaging. The technical details are presented in a clear and concise manner, and the project's features and tech stack are easy to understand.",No commits found during hackathon period.
,,0,0,0,0,Error during evaluation: 'float' object has no attribute 'endswith',Error during evaluation: 'float' object has no attribute 'endswith',Error during evaluation: 'float' object has no attribute 'endswith'
Team-Doraemon/CaliSEC-Protocol,https://github.com/Team-Doraemon/CaliSEC-Protocol,2,4,1,7,"Unfortunately, this README does not provide clear installation steps or dependencies required to run the project. While it provides a comprehensive overview of the CaliSEC protocol, its features, and architecture, it lacks step-by-step instructions on how to install and set up the project. The README assumes that the reader is familiar with the underlying technologies and protocols, which may not be the case for users who are new to the project. To improve the installation process, the README should include clear instructions on how to install the required dependencies, set up the project, and configure the necessary components.","The README file is generally well-structured and easy to follow, with clear headings and a logical flow. The language is professional and technical, making it suitable for an audience familiar with the topic. However, there are some minor issues that prevent it from being a perfect 5.",No commits found during hackathon period.
