project_name,github_link,readme_installation_score,readme_quality_score,commit_activity_score,total_score,readme_installation_comments,readme_quality_comments,commit_activity_comments
Pranav-Marwaha-73/ChainGuard-Decentralized-AI-Security-Agent,https://github.com/Pranav-Marwaha-73/ChainGuard-Decentralized-AI-Security-Agent,3,3,2,8,"The README provides a basic overview of how to set up the project, but it is not a comprehensive step-by-step installation guide. The installation steps are scattered throughout the README, and some dependencies are not clearly listed. For example, the use of `venv` and `ngrok` is not explicitly mentioned, and the installation of `React.js`, `Vite`, and other frontend dependencies is not detailed.","The README file is generally easy to follow, and the inclusion of images helps to illustrate the features and functionality of the ChainGuard-Decentralized-AI-Security-Agent. However, there are some areas where the clarity and structure could be improved.","The total number of commits during the hackathon period is 12, which is not extremely low, but still indicates a relatively low level of activity. The recent commit messages all refer to updating the README.md file, which suggests that most of the commits are minor changes rather than significant developments. While the consistency of development activity is difficult to assess with such a small number of commits, it appears that the majority of the commits were made in a short period of time, which could indicate a burst of activity rather than sustained development. Overall, the commit activity suggests that the project had some development during the hackathon period, but it was mostly minor changes and not particularly significant or consistent."
ArksRWA/ArksRWA,https://github.com/ArksRWA/ArksRWA,4,4,1,9,"The README file provides a good overview of the project and its features, but the installation steps could be more detailed. The file is well-organized, and the prerequisites are clearly listed. However, the installation steps themselves are somewhat brief and lack specific instructions for setting up the environment. For example, the README mentions that the user should ""start the local IC replica in background"" without providing the exact command.","This README file is generally clear and well-structured, with a logical flow from introduction to setup to configuration and API reference. The use of headers and formatting is effective in breaking down the content into manageable sections. The language is professional, and the explanations are clear and concise.",No commits found during hackathon period.
agusdwyna/LearnChain,https://github.com/agusdwyna/LearnChain.git,4,4,2,10,"The README provides a good overview of the project and its components, but it could be more detailed in its installation instructions. The provided steps are clear and easy to follow, but some dependencies are not explicitly listed. For example, it is not clear what Node.js version is required, or if any additional tools need to be installed. Additionally, the README assumes that the reader has some basic knowledge of the Internet Computer development environment and its tools (e.g., dfx, Motoko). While this may be sufficient for experienced developers, it may be overwhelming for newcomers.","The README is generally clear and well-organized, making it easy to follow for a reader who is new to the `learnchain` project. The introduction provides a good overview of the project and its purpose, and the subsequent sections provide a logical flow of information for getting started with the project.","The project has only 2 commits during the entire hackathon period, which is a very low activity. Although the commit messages are somewhat meaningful, with the first commit being an ""Initial commit."", the lack of regular commits and meaningful development activity throughout the hackathon period assigns a score of 2, which is ""Poor""."
naufalbintang/NeuraX,https://github.com/naufalbintang/NeuraX,4,4,1,9,"The README provides a clear overview of the installation process, breaking it down into several steps. It covers the requirements for deploying from ICP Ninja, as well as the process for building and deploying from the command-line. The steps are generally easy to follow, and dependencies are listed, such as the IC SDK and Ollama. However, some steps are a bit vague, such as the expectation to start the Ollama server and download the LLM model. Additionally, the README assumes some basic knowledge of the IC SDK and Ollama, which may not be obvious to all users. Overall, the installation steps are good, but could be more detailed and user-friendly.","The README file is generally clear and well-organized, with a good logical structure and flow. The use of headers and formatting is effective in breaking up the content into manageable sections. The explanations are clear, and the tone is professional.",No commits found during hackathon period.
,,0,0,0,0,Error during evaluation: 'float' object has no attribute 'endswith',Error during evaluation: 'float' object has no attribute 'endswith',Error during evaluation: 'float' object has no attribute 'endswith'
gnvpradeep/The-savior-of-the-warrior,https://github.com/gnvpradeep/The-savior-of-the-warrior,3,0,1,4,"The README provides a basic overview of how to install the project, but it could be more detailed. The instructions start with ""To get started, download the project from GitHub and extract it to a directory of your choice."" This is a good start, but it's not clear what dependencies are required or what prerequisites are necessary. The next step is to ""run the setup.py file,"" but it's not explained how to do this or what the setup.py file does. Additionally, there is no mention of how to install any dependencies or libraries required for the project. Overall, the README provides enough information to get started, but it's not a comprehensive guide.",No quality assessment provided.,No commits found during hackathon period.
zdnemz/eduverse,https://github.com/zdnemz/eduverse,3,4,3,10,"The README provides some basic installation steps, but they could be more detailed. The steps are summarized in three sections: cloning the repository, installing DFX and dependencies, and starting local development. However, the steps are not exhaustive, and some dependencies are not clearly listed. For example, the README mentions installing DFX, but it does not specify how to install it. Additionally, the README could benefit from a more detailed explanation of the prerequisites, such as the system requirements for running the project.","The README file has a clear and concise structure, with well-organized sections and headers. The use of formatting, such as bold text and diagrams, helps to make the content easy to follow. The writing is generally clear and professional, with only minor grammatical errors.","There were 6 commits during the hackathon period, which is a decent number. The recent commit messages suggest that the project saw some meaningful development, such as integrating clsx and tailwind-merge, adding frontend configuration, and updating the README and adding a license. However, the commit messages are mostly focused on merging branches, modifying documentation, and updating README files, which could indicate a relatively slow pace of development. Additionally, the commit messages lack detail about the specific changes made, making it difficult to gauge the impact of the changes. Overall, while there was some activity during the hackathon period, it could be more active and focused on actual project development."
stanlys96/Engramind-ICP,https://github.com/stanlys96/Engramind-ICP,1,4,4,9,"There are no installation steps provided in this README file. The content focuses on explaining the concept, creation, and potential applications of Engramind, but fails to provide any information on how to install or run the project. The file includes screenshots, a demo video link, and technical details, but lacks the essential installation instructions that a technical reviewer would expect to see.","The README file is generally well-structured and clear, with a logical flow and good use of headers and formatting. The language is professional, and the explanations of the Engramind project are concise and easy to follow. The inclusion of screenshots, a demo video, and technical details about the AI-powered persona generation process is helpful.","The project has a moderate level of commit activity during the hackathon period, with a total of 50 commits. The recent commit messages suggest a focus on implementing chat functionality, with some refactoring and testing. The commit messages are descriptive and indicate meaningful development activity. While there is some consistency in the commit frequency, it's not extremely high or consistent throughout the entire hackathon period. Overall, the project shows good development activity, but could potentially benefit from more active development and consistency."
