project_name,github_link,readme_documentation_score,commit_activity_score,dfx_json_score,total_score,readme_documentation_comments,commit_activity_comments,dfx_json_comments
Panorama-Block/zico_agents,https://github.com/Panorama-Block/zico_agents,4,2,1,7,"The README file provides a good overview of the project, including its vision, problem statement, and solution. The technical architecture is well-organized and includes a diagram, which helps to illustrate the components and their relationships. However, the documentation is missing some key elements, such as setup instructions for local development, integration instructions, and contribution guidelines.","2 - Commits every other week. Weekly development summary: Week of 2025-08-01: This week, the development team refactored the avax feature and fixed issues with the Contracts API. No new features were added, but the refactor and fixes likely improved the overall stability and performance of the avax feature.; Week of 2025-08-08: This week, the development team added a new Zico version and integrated Thirdweb into the system, representing new features built. Additionally, the contracts API was refactored, likely improving the underlying architecture. Overall, the changes aim to enhance the system's capabilities and stability.; Week of 2025-08-22: This week, the development team added new features to the Zico Agent API, including a token swap agent, crypto data fetcher, and real-time search functionality. They also improved the supervisor agent by adding a swap agent and modifying the crypto data tools to include metadata and sentiment analysis. Additionally, they updated the app.py file to include a new agents list and modified the chatMessage model to include new fields for action requirements and types. Overall, the changes focus on expanding the API's capabilities and improving the supervisor agent's functionality.",dfx.json file found - indicates ICP/Dfinity project structure
AbdoViper23/halaqa-Save,https://github.com/AbdoViper23/halaqa-Save,4,0,1,5,"The documentation is good, but it could be more detailed. The README file provides a clear and concise overview of the project, including its purpose, problem it solves, and key features. The project description is well-structured, and the inclusion of logos, icons, and shields adds a touch of personality.",No commits found during hackathon period.. No weekly development activity to summarize.,dfx.json file found - indicates ICP/Dfinity project structure
nishant2253/blockJunctionICP,https://github.com/nishant2253/blockJunctionICP,3,0,1,4,"The README file provides a good general project description, highlighting the key features and benefits of BlockJunction. It also includes some implementation details and technical information, such as the Route Finder algorithm and execution methods. However, it lacks setup instructions for local development, which is an important element for technical writers and developers. Additionally, there is no integration guide, which would be crucial for users who want to integrate the platform with their existing systems. Contribution guidelines are also missing, making it difficult for potential contributors to get involved. Overall, the documentation is informative but could be more comprehensive and user-friendly.",No commits found during hackathon period.. No weekly development activity to summarize.,dfx.json file found - indicates ICP/Dfinity project structure
Darthpool9900/gap_project,https://github.com/Darthpool9900/gap_project,4,1,1,6,"The README file provides a good overall description of the project, its components, and its features. It includes a clear project overview, a breakdown of the project structure, and a list of key features. The screenshots provide a visual representation of the project's interface, which is helpful for understanding the user experience.","1 - 1 or 2 commits. Weekly development summary: Week of 2025-08-15: This week, the developer focused on refactoring the project structure and removing unused dependencies, making significant changes to the project's underlying architecture. No new features were added, but the improvements aim to improve the overall maintainability and efficiency of the project.",dfx.json file found - indicates ICP/Dfinity project structure
PostedApp/wchl,https://github.com/PostedApp/wchl,2,0,1,3,"The README file provides some basic information about the project, including a high-level description, architecture diagrams, and a brief overview of the project's features and innovation. However, it lacks essential information such as setup instructions for local development, general project description, and contribution guidelines. The file appears to be more focused on showcasing the project's capabilities rather than providing comprehensive documentation for users. Additionally, there is no clear explanation of how to get started with the project, making it difficult for potential contributors or users to understand how to engage with the project. Overall, the documentation is limited and could be improved with more detailed information and better organization.",0 - no commits. No weekly development activity to summarize.,dfx.json file found - indicates ICP/Dfinity project structure
crypdrag/HodlHut,https://github.com/crypdrag/HodlHut,4,1,1,6,"The README file provides a good general project description, outlining the features and concept of HodlHut. It also includes setup instructions for local development, including installation requirements and commands to run the prototype. However, the documentation could be more detailed in some areas. For example, the integration guide is limited to a high-level overview of the architecture and does not provide specific instructions on how to integrate the project with other systems. Additionally, the contribution guidelines are not explicitly stated. Overall, the documentation is clear and well-structured, but could benefit from more depth and explicit guidelines for contributors.","1 - 1 or 2 commits. Weekly development summary: Week of 2025-08-22: This week, the development team added new features such as ICP integration, improved the DEX selection UI, and implemented a comprehensive CSS variable system, while also fixing various layout and styling issues to enhance the user experience and overall usability of the platform. Additionally, they replaced token SVG files with Lucide React icons and improved the production-ready 7-agent intelligence system. These changes significantly improved the visual cohesion and usability of the platform, making it more readable and user-friendly.",dfx.json file found - indicates ICP/Dfinity project structure
kelvinpraises/agentix,https://github.com/kelvinpraises/agentix,3,2,0,5,"The documentation is decent, but it falls short in providing comprehensive information about the project. While it includes a high-level overview of the system architecture and its components, there is no setup instructions for local development, project description, integration guide, or contribution guidelines. The diagram is well-structured and provides a good visual representation of the system's architecture, but it assumes the reader has prior knowledge of the system's components and their relationships. Additionally, there is no clear explanation of how to use the system, how to contribute to it, or how to integrate it with other systems. Overall, the documentation is basic and needs more detail to be considered excellent or even good.","2 - Commits every other week. Weekly development summary: Week of 2025-08-01: This week, significant new features were added to support hierarchical profile management, sector-orb-thread architecture, policy type definitions, trading strategies, server configuration, message queue worker services, AI trade execution tools, AI trade building tools, AI trading journal tools, and more. Existing features were also improved with enhanced API controllers, robust validation, database JSON column operations, and improved usability. Overall, these changes aim to improve the platform's architecture, consistency, usability, and performance, enabling more efficient data handling and user experience, as well as expanding its analysis and decision-making capabilities.; Week of 2025-08-15: This week, the development team added numerous features to enhance the trading infrastructure, including a comprehensive journal entry type system, multi-chain constants, a comprehensive service registry, sector and orb filtering, and versioned policy management per sector. Existing features were improved, such as type safety, error handling, complex query capabilities, portfolio service, sentiment service, trade execution neural tools, and policy controller. The overall impact of these changes is a more robust, scalable, and user-friendly trading infrastructure with improved support for multi-chain trading, enhanced service layer architecture, and advanced trading capabilities.",No dfx.json file found - may not be using standard ICP/Dfinity development tools
https://github.com/xfusion-dev,https://github.com/xfusion-dev,0,0,0,0,Error during evaluation: list index out of range,Error during evaluation: list index out of range,Error during evaluation: list index out of range
gucorinthians/ICPInsurance,https://github.com/gucorinthians/ICPInsurance,3,0,1,4,"The README file provides a decent introduction to the project, including a brief description of the template's purpose and two available official plugins. However, it falls short in several areas. Firstly, there are no setup instructions for local development, which would be crucial for users to get started with the project. The file also lacks a general project description, which would provide context and help users understand the project's scope and goals. Additionally, there is no integration guide or contribution guidelines, which are important for users to know how to integrate the template with their existing projects and how to contribute to the project itself.",No commits found during hackathon period.. No weekly development activity to summarize.,dfx.json file found - indicates ICP/Dfinity project structure
Buildathonzx/whisperrnote,https://github.com/Buildathonzx/whisperrnote,3,1,0,4,"The README file provides a good overview of the project's concept, features, and technology stack. It highlights the unique selling points of WhisperRNote, such as AI-powered intelligence and blockchain-secured privacy. However, it lacks essential information on setup instructions, integration guide, and contribution guidelines.","1 - 1 or 2 commits. Weekly development summary: Week of 2025-08-22: This week, the development team introduced a significant UI overhaul, aligning the application with the Appwrite backend, featuring a unified theming system, responsive navigation, and refactored UI components. Additionally, the team improved the underlying structure of the application by refactoring the schema and making minor updates to the project plan, laying the groundwork for future developments.",No dfx.json file found - may not be using standard ICP/Dfinity development tools
Txrmarcos/TaaS,https://github.com/Txrmarcos/TaaS,4,2,1,7,"The README file provides a good general overview of the TaaS project, including its purpose, architecture, and financial analysis. The project description is clear and concise, and the inclusion of images and icons adds visual appeal.","2 - Commits every other week. Weekly development summary: Week of 2025-08-01: This week, a new canister was added, and the `canister_ids.json` and `dfx.json` files were modified to include the new canister. Additionally, the `frontend/src/app/notice/page.tsx` file was added, which suggests the implementation of a new feature. Overall, these changes indicate the addition of a new canister and a new feature in the frontend.; Week of 2025-08-08: This week, several new features were added to the application, including a newsletters system, user management, and a comments section. The existing features were also improved, such as the PostCard component, which now includes a formatPrincipal function to shorten the principal's name. Additionally, several files were added, including backend/newsletters/newsletters.mo, backend/users/users.mo, and frontend/src/app/users/page.tsx, and some files were modified, such as frontend/src/app/notice/page.tsx.; Week of 2025-08-15: This week, the development team added a ""Publish News"" page and improved the settings by setting the DFX version to 0.28.0 in the dev container. They also modified the navigation bar and applied a background style to all pages. Additionally, they integrated with Fedd and improved the news feed by adding a sidebar, enhancing the overall user experience and providing a more streamlined interface.; Week of 2025-08-22: This week, new features were added to the user profile area, allowing users to view and manage their posts, and to add comments to news articles. The landing page was refactored to include a login/logout functionality and a hero section. The news feed page was also improved to include the ability to add posts to a user's profile. Additionally, the code was refactored to improve the overall structure and readability.",dfx.json file found - indicates ICP/Dfinity project structure
sharp119/advert_unified,https://github.com/sharp119/advert_unified,3,1,0,4,"The README file provides a good overview of the ADVERT project, its vision, problem, and solution. The sections are well-structured, and the content is generally clear and concise. However, it lacks some essential elements that would make it an excellent documentation.","1 - 1 or 2 commits. Weekly development summary: Week of 2025-08-01: This week, the development team added new features including venue and geo location, panel creation, anchor and viewer entry, and mid-air placement, as well as introduced the concept of ""expolens"". Existing features were improved, including drag and drop functionality, 3D visualizer enhancements, node management, and data communication. The overall impact of the changes enhances the user experience, provides more functionality to the application, and enables more efficient node management and data communication.",No dfx.json file found - may not be using standard ICP/Dfinity development tools
MrAech/InheritNext,https://github.com/MrAech/InheritNext,4,1,1,6,"The README file provides a good general overview of the project, including its purpose, key features, and architecture. It also includes a concise visual of the main application flow, which is helpful for understanding the system's behavior.","1 - 1 or 2 commits. Weekly development summary: Week of 2025-08-15: This week, the development team made significant progress by adding new features such as the DistributionsPage, AuthExpiryBanner, DistributionsManager component, and IntegritySummary component, as well as improving existing features like the Dashboard, timer handling, and authentication context. The team also overhauled the AssetDistribution component, fixed type definitions, and made various improvements to code quality, readability, and error handling. Overall, these changes aim to enhance the user experience, improve app flow, and strengthen the authentication mechanism.",dfx.json file found - indicates ICP/Dfinity project structure
lucas-surdo/mydrops,https://github.com/lucas-surdo/mydrops,4,0,1,5,"The documentation is generally good, providing a clear overview of the project, its features, and its structure. It also includes setup instructions for local development, which is excellent. The project description is concise and informative, giving users a good understanding of what My Drops is and what it can do. The integration guide is also well-structured, providing step-by-step instructions for running the frontend with mock data and with the actual ICP backend.",No commits found during hackathon period.. No weekly development activity to summarize.,dfx.json file found - indicates ICP/Dfinity project structure
pixeliy/pixeliy,https://github.com/pixeliy/pixeliy,4,0,1,5,"The README file is well-structured and provides a good overview of the Pixeliy project, its features, and its architecture. The documentation is clear and easy to follow, making it suitable for both technical and non-technical readers. The setup instructions for local development are comprehensive, covering the installation of dependencies, cloning the repository, and deploying canisters. Additionally, the documentation provides links to relevant resources, such as the project's website and the Internet Computer SDK.",No commits found during hackathon period.. No weekly development activity to summarize.,dfx.json file found - indicates ICP/Dfinity project structure
Youssefahmed88/ic-green-ledger,https://github.com/Youssefahmed88/ic-green-ledger,4,1,1,6,"The README file provides a good overview of the project and its purpose, as well as some basic setup instructions for local development. It includes links to external documentation resources and provides some helpful commands for getting started. However, the documentation could be more detailed and comprehensive. For example, the section on running the project locally is brief and doesn't provide much information on how to troubleshoot or debug issues. Additionally, there is no clear explanation of how to contribute to the project or what the expected workflow is for submitting changes.","1 - 1 or 2 commits. Weekly development summary: Week of 2025-08-08: This week, the development team made significant improvements to the green ledger backend, including the addition of new features and file changes. Specifically, they added support for farmer profiles, improved the policy management system, and updated the storage and types modules to handle new data structures. Additionally, they modified the payouts, policy, and weather modules to enhance their functionality and added new files such as `farmer.rs`, `nft.rs`, and `payout.rs`.",dfx.json file found - indicates ICP/Dfinity project structure
Sheko100/blockx,https://github.com/Sheko100/blockx,3,2,1,6,"The README file provides a good general project description, including a brief introduction to Verisys and its purpose. It also includes some setup instructions for building and deploying the project, which is a good start. However, the documentation could be more detailed and comprehensive.","2 - Commits every other week. Weekly development summary: Week of 2025-08-01: This week, a new React-based frontend was built for the BlockX project, replacing the previous Svelte-based implementation. The new frontend features a modern UI/UX design, improved navigation, and added support for user authentication and routing. Additionally, the project's build process was migrated from Rollup to Vite, and various dependencies were updated to their latest versions.; Week of 2025-08-08: This week, the development team laid the foundation for future growth and expansion by adding four new modules: storage, asset, utils, and hash, as well as a new user module and agent controller, introducing a new feature to the application. Although no existing features were modified or improved, the team made minor internal updates to the configuration and files. Overall, the changes lay the groundwork for future development and improvement, setting the stage for the creation of new features and the refinement of existing ones.; Week of 2025-08-15: This week, the development team focused on refining the application's components, including the frontend, config, and backend. While no new features were added, existing components were updated to improve overall performance, functionality, and stability. The dynamic time feature was introduced, and declarations were revised, contributing to a more cohesive and efficient application.; Week of 2025-08-22: This week, a new feature was added with the creation of the CertificatePDF.jsx file, allowing for the generation of PDF certificates. The initial state of the project has been expanded with this new component, bringing new functionality to the frontend. The changes are focused on the frontend logic, specifically in the components directory, indicating improvements to the user interface and experience.",dfx.json file found - indicates ICP/Dfinity project structure
KaizenOrg/kaisen,https://github.com/KaizenOrg/kaisen,4,2,1,7,"The documentation quality is good, but it could be more detailed. The README file provides a general overview of the project, including its purpose, features, and architecture. It also includes links to other documents for more information, which is a good practice. However, it lacks setup instructions for local development, which would be important for contributors or developers who want to work on the project.","2 - Commits every other week. Weekly development summary: Week of 2025-08-01: This week, the development team added new features such as the community card, skeleton of ""continueCard"" and ""postcard"", generic modal components, and a new component for tracking published and unpublished tracks. They also improved existing features like user authentication, error handling, and layout configuration settings, resulting in enhanced user experience, improved code structure, and increased consistency and readability of the application. Overall, the changes aim to provide a more organized and maintainable application with better functionality.; Week of 2025-08-08: This development week saw the addition of several new features, including a loading bubble in the track chat, interactive particle background, tutorial system, tutoring system, chatbox, and toast notification system. Existing features were improved with refactored routing, enhanced UI components, and improved navigation and section display logic. These changes significantly enhance the user experience, providing a more engaging interface with new visual effects, improved functionality, and better interaction and presentation.; Week of 2025-08-15: This week, the development team added several new features, including the ability to save track time, a Business Model Canvas in the documentation, and a tutorial feature with minting logic and user completion tracking. Existing features, such as the NFT modal, were improved with visualization enhancements and fixes for importation issues. Overall, the changes enhanced the user experience, improved documentation quality, and introduced a progressive track feature, representing a significant development milestone.; Week of 2025-08-22: This week, improvements were made to the high-fidelity prototypes, with new images added to the screens application folder and updates to the documentation. The `documents/wad.md` file was modified, adding content related to the second version of the application and its development. Additionally, the `documents/assets/screens-aplication` folder saw the addition of new images, such as `nft-awarded.png` and `profile-overview.png`.",dfx.json file found - indicates ICP/Dfinity project structure
k0t11k/FINAL-REV_ERAICP,https://github.com/k0t11k/FINAL-REV_ERAICP,3,0,1,4,"The README file provides a good overview of the project, its features, and technology stack. However, it lacks setup instructions for local development, integration instructions, and contribution guidelines. The file is well-structured and easy to follow, but it falls short in providing essential information for developers and contributors.",No commits found during hackathon period.. No weekly development activity to summarize.,dfx.json file found - indicates ICP/Dfinity project structure
Brunocmarino/hackathon-ICPHubBR,https://github.com/Brunocmarino/hackathon-ICPHubBR,4,0,1,5,"The documentation is good, but it could be more detailed. The README file provides a general overview of the project, its features, and the technologies used. The instructions for installation and execution are also present, which is a significant strength. However, the documentation could be improved by including more context about the project's goals, its target audience, and the decision-making process behind the choice of technologies.",No commits found during hackathon period.. No weekly development activity to summarize.,dfx.json file found - indicates ICP/Dfinity project structure
joaosotto/ICP-TicketSystem,https://github.com/joaosotto/ICP-TicketSystem,4,0,1,5,"The documentation is good, providing a clear overview of the project's purpose, features, and technology stack. The technical aspects are well-documented, including the architecture, components, and technologies used. However, it lacks a general project description that would help readers understand the context and motivation behind the project.",No commits found during hackathon period.. No weekly development activity to summarize.,dfx.json file found - indicates ICP/Dfinity project structure
sourcerer7/ak69,https://github.com/sourcerer7/ak69,0,0,0,0,No documentation assessment provided.,No commits found during hackathon period.. No weekly development activity to summarize.,No dfx.json file found - may not be using standard ICP/Dfinity development tools
