original_job_id,job_id,title,institution,company_id,location,experience_years_required,experience_level,field_of_study,salary_min,salary_max,published_at,expires_at,status,real_total_applicants,real_total_engagements
4000000000-801102150000000000-00319,d9484b77-fbe3-5448-8b3a-9df1e974cdc5,Health And Sanitation Officer,NGOMA DISTRICT,2cba1cd1-01b2-585b-a41f-40719659af36,Ngoma,0,entry,"Natural Sciences, Mathematics and Statistics",220000,262959,10/09/2026,12/12/2026,active,341,341
5400003001-211100000000000000-00045,c549d6c5-a625-5b5b-af7a-ae8d225e0efe,Infrastructure Maintenance Officer A1/A0,RUSIZI DISTRICT,ccdd88e7-36d4-5f77-8419-148f566e219f,Rusizi,0,entry,"Natural Sciences, Mathematics and Statistics",220000,260366,16/08/2026,05/04/2027,active,1,1
5000000000-801101010200000000-00041,e55ed573-aa49-5afa-9fe5-fe3436da36cb,Construction Permitting Officer,MUHANGA DISTRICT,36d554e4-6fbb-53ca-aae7-53010481a5f7,Muhanga,0,entry,"Engineering, Manufacturing and Construction",220000,278498,10/10/2026,25/04/2027,active,437,437
5200000000-801104180000000000-00088,ce4b55b7-3004-5e9c-b9ab-17c674b1e543,Secretary and Customer Care,NYANZA DISTRICT,59f60bc1-38a0-554a-8be5-c603b26aa28b,Huye,0,entry,"Business, Administration and Law",220000,287392,14/10/2026,04/03/2027,active,279,279
0800000000-101000000000000000-00091,7bd16460-4ab0-5120-bfb4-73789575547b,Administrative Assistant,Ministry of Foreign Affairs and International Cooperation,8829c2b2-9325-561d-bbf1-693a04731d39,Gasabo,0,entry,"Business, Administration and Law",220000,253081,04/10/2026,08/02/2027,active,670,670
1413000000-901050000000000000-00153,9a89ae27-fbd5-5b5a-ba60-7c6cdfb6cd6c,English and Kiswahili teacher A0,RWANDA BASIC EDUCATION BOARD,095aeb11-7497-50e3-9448-15f9a12a6d07,Rusizi,0,entry,Education,220000,260637,07/09/2026,30/04/2027,active,2116,2116
5800000000-801101032305000000-00323,7136e8bc-8fc2-5778-baa7-5b79d240f2dc,Executive Secretary,NGORORERO DISTRICT,03e7a4e2-5073-53f7-bef5-778974608c8a,Nyamasheke,3,mid,"Natural Sciences, Mathematics and Statistics",475000,659429,20/09/2026,18/01/2027,active,1191,1191
1412001000-301205080000000000-00195,259e12eb-213b-5779-9b7a-54d908d0a540,Assistant Instructor in Fashion Design (FAD),RP KIGALI COLLEGE,98dd66ee-6500-5d25-ae65-e5c8c8b7e2ca,Nyamagabe,0,entry,Arts and Humanities,220000,286396,08/06/2026,29/12/2026,active,14,14
2201000000-090101040000000000-00040,e8e9427e-5100-5ede-bf8b-7aa68ddf899e,Accountant,RWANDA ENVIRONMENT MANAGEMENT AUTHORITY,42d71c20-d5d9-5490-ab5d-33c95b2de8c7,Gasabo,0,entry,"Business, Administration and Law",220000,260740,23/09/2026,05/03/2027,active,556,556
1601000000-201022020700000000-00109,eb7ab185-6709-576c-9ff8-2145300d49f0,Nurse in Accident & Emergency Department,CENTRAL UNIVERSITY HOSPITAL OF KIGALI,29616e3e-5b8f-597b-9988-05cd7dd37c14,Nyamagabe,5,senior,Health and Welfare (Health and Medical Sciences),525000,619000,06/07/2026,22/02/2027,active,543,543
6600000000-801102020000000000-00042,294357d0-b47a-5607-b835-ae5b0cca2ddc,District Infrastructure Property Management Officer,RUHANGO DISTRICT,47f78d9e-5fd5-57bf-aa7f-abb47fe487df,Musanze,0,entry,"Business, Administration and Law",220000,284228,08/06/2026,28/09/2026,active,95,95
4400000000-801100000000000000-00079,04ac826a-2c42-58e4-bcb4-5fa1ed7846fb,Administrative Assistant,KIREHE District,3fcb36e2-946d-5fa4-8f12-4daf1e0ee358,Huye,0,entry,"Business, Administration and Law",220000,258888,27/07/2026,09/01/2027,active,485,485
2318000000-901103000000000000-00003,003b29ef-4c23-5b45-bac9-bce3f083c4f1,Chief Cook,NATIONAL REHABILITATION SERVICE,37d37d39-6884-5b72-813c-5be1d0aebeab,Muhanga,0,entry,"Services, Tourism and Hospitality",220000,274559,17/07/2026,23/01/2027,active,36,36
5700000000-080101010400000000-00050,af7073d7-eebb-5d64-a1d7-ec4d199c0ac1,Environmental Officer,KARONGI District,850a9fe3-e6e6-5af6-a956-e50c7dad50c9,Karongi,0,entry,"Natural Sciences, Mathematics and Statistics",220000,275702,24/07/2026,22/01/2027,active,141,141
2903000000-902000000000000000-00021,64d94575-b78b-5a77-be46-8946f5229ebd,Procurement Specialist,RWANDA FORESTRY AUTHORITY,db8947ee-6112-5748-b14c-a84efb32d51e,Musanze,7,lead,"Business, Administration and Law",575000,743882,04/08/2026,01/02/2027,active,2162,2162
2206000000-090301010101000000-00037,c9f5717c-ddf0-542a-a408-7fb1ee66c5d1,Geodetic Network  Administrator,NATIONAL LAND AUTHORITY,d5d4f331-8023-54d0-9e47-45ac59d2786d,Gakenke,0,entry,"Business, Administration and Law",220000,297346,26/08/2026,23/04/2027,active,292,292
2205000000-140000000000000000-00021,f16fe81a-1a94-56cd-b973-b99d8693a58a,Legal Affairs Specialist,"Rwanda Mines,petroleum And Gas Board",1d3e4db1-00f0-5eca-8451-c3f669797a62,Nyamasheke,3,mid,"Business, Administration and Law",475000,552301,03/08/2026,08/11/2026,active,27,27
5700003001-020000000400000000-00066,0e1abbaf-bf24-5d0f-bd3e-737c231c04ed,Data Manager A1/A0,KARONGI District,850a9fe3-e6e6-5af6-a956-e50c7dad50c9,Karongi,0,entry,"Business, Administration and Law",220000,280301,30/06/2026,28/11/2026,active,584,584
4400003001-201012020000000000-00164,939792c1-7d00-504b-9059-b68c9bfd1e2d,Social Worker A2,KIREHE District,3fcb36e2-946d-5fa4-8f12-4daf1e0ee358,Nyarugenge,0,entry,Health and Welfare (Health and Medical Sciences),220000,271739,03/06/2026,01/10/2026,active,199,199
5800003001-201011000000000000-00006,b213a8dc-9cfd-5e84-8a79-02ee435b748a,Head of Anesthesia Technician A1/A0,NGORORERO DISTRICT,03e7a4e2-5073-53f7-bef5-778974608c8a,Rusizi,0,entry,Health and Welfare (Health and Medical Sciences),220000,285764,29/09/2026,05/02/2027,active,4,4
1413000000-901050000000000000-00111,a1feb16f-3b80-57ef-9a6f-52f7a2e4417b,Physics and ICT teacher A1,RWANDA BASIC EDUCATION BOARD,095aeb11-7497-50e3-9448-15f9a12a6d07,Rusizi,0,entry,Education,220000,306020,15/08/2026,01/01/2027,active,945,945
1605001099-090000000000000000-00433,7dfab696-1d8b-5637-9091-66e3715f0d47,Incharge of Commodities Senior Officer,RWANDA BIO MEDICAL CENTER,fff3e870-09bd-55ae-a770-c558a61b9c12,Nyamagabe,3,mid,"Natural Sciences, Mathematics and Statistics",475000,559958,07/07/2026,27/10/2026,active,18,18
1302000000-901204000000000000-00004,faf039c6-b575-5fd3-938e-acae35b6d294,Lecturer,INSTITUTE OF LEGAL PRACTICE AND DEVELOPMENT,0639878e-0707-52a3-a2f9-7e66fd0561b0,Burera,3,mid,"Business, Administration and Law",475000,582044,07/10/2026,21/01/2027,active,48,48
1602000000-201106020000000000-00002,5f388e2f-ca0a-521c-8e67-a12951bbf0f1,Grant Management Specialist,CENTRAL UNIVERSITY HOSPITAL OF BUTARE,1cc90452-1205-5182-b85d-1874e4c0b5aa,Gakenke,3,mid,"Business, Administration and Law",475000,557349,24/08/2026,20/01/2027,active,12,12
1413000000-901050000000000000-00106,2dee2933-ab91-5256-9b7e-cf2f98791942,Biology and Geography teacher A1,RWANDA BASIC EDUCATION BOARD,095aeb11-7497-50e3-9448-15f9a12a6d07,Ngoma,0,entry,Education,220000,258415,30/07/2026,31/01/2027,active,1204,1204
1413000002-090000000000000000-00008,6012672d-3deb-5cc1-adcc-bd37accfb744,Financial Management Specialist,RWANDA BASIC EDUCATION BOARD,095aeb11-7497-50e3-9448-15f9a12a6d07,Gicumbi,5,senior,"Business, Administration and Law",525000,664629,07/06/2026,31/12/2026,active,5,5
2902000000-140101000000000000-00016,f3a1200c-8798-5685-a50d-2ba904c8fa06,Environmental Flow Management (transboundary) Specialist,Rwanda Water Resources Board,bc03a799-837d-5602-a105-0d3bc3efda7b,Kicukiro,5,senior,"Business, Administration and Law",525000,626424,17/07/2026,21/01/2027,active,234,234
5500000000-801103020000000000-00040,0c5a080a-6cee-5d20-9f0f-4eb7a1365019,Land administrator,NYABIHU DISTRICT,3072086c-23c7-5d94-ab83-8a26850e0780,Nyagatare,0,entry,"Business, Administration and Law",220000,272697,11/09/2026,10/04/2027,active,224,224
5200000000-801104060000000000-00060,ae1a170f-253a-52b7-be71-80b6eabea014,Graduation Officer,NYANZA DISTRICT,59f60bc1-38a0-554a-8be5-c603b26aa28b,Rutsiro,0,entry,Education,220000,275996,13/10/2026,17/02/2027,active,2233,2233
4000000000-801102190000000000-00048,f753f5b7-f691-5787-b012-69cd727c08fc,Animal Resources Officer,NGOMA DISTRICT,2cba1cd1-01b2-585b-a41f-40719659af36,Ngoma,0,entry,"Natural Sciences, Mathematics and Statistics",220000,267281,29/10/2026,03/02/2027,active,225,225
1903000000-150103030000000000-00211,b057dfd2-b89c-51d4-b9d6-cf33dc5376f1,Network & Systems Administration Specialist,RWANDA INFORMATION SOCIETY AUTHORITY,9bb84a42-8cd4-5d59-80cf-5b9583db52fa,Nyagatare,3,mid,"Business, Administration and Law",475000,638808,04/10/2026,29/01/2027,active,1447,1447
4400000000-803600000000000000-00320,587e6f6e-5075-5234-884a-db1540c440c6,Civil Registration and Notary,KIREHE District,3fcb36e2-946d-5fa4-8f12-4daf1e0ee358,Karongi,0,entry,"Business, Administration and Law",220000,256330,18/07/2026,25/01/2027,active,149,149
0901000000-140504000000000000-00057,60d226fd-cfe9-5f78-81d7-c01dac612621,Laboratory Services Manager,RWANDA AGRICULTURE AND ANIMAL RESOURCES DEVELOPEMENT BOARD,99fc44bf-3a5d-5cf2-bb48-d634310e7de8,Nyamasheke,5,senior,"Natural Sciences, Mathematics and Statistics",525000,624738,26/10/2026,22/03/2027,active,130,130
5100000000-080000000000000000-00376,3b003ac8-d419-5dc9-9712-652efd8850c2,"IN CHARGE OF DISCIPLINARY,CIVIC EDUCATION,AND NUTRITION IN TRANSIT CENTER (UNDER CONTRACT)",KAMONYI DISTRICT,30d0d5e5-7597-5c8c-a2fc-475f3f56cf79,Rutsiro,0,entry,Education,220000,300364,27/09/2026,04/02/2027,active,1066,1066
5100003001-020000001900000000-00006,2f6df205-0207-5255-b4dd-6335e4083a78,Head of Lab A0,KAMONYI DISTRICT,30d0d5e5-7597-5c8c-a2fc-475f3f56cf79,Karongi,0,entry,Health and Welfare (Health and Medical Sciences),220000,287463,29/10/2026,01/06/2027,active,58,58
4700000000-801301010000000000-00082,249bee58-4bdb-5b6f-9c85-f1ed1dea9d98,Secretary to Finance Unit,HUYE DISTRICT,8389d518-a63f-5b73-b6aa-59f323787365,Huye,0,entry,"Business, Administration and Law",220000,268372,16/08/2026,13/01/2027,active,306,306
0901000000-140501050000000000-00104,d6b849e3-ab94-5848-bf0d-35b2eed5ef38,Fruit Agronomist & physiologist Research Fellow,RWANDA AGRICULTURE AND ANIMAL RESOURCES DEVELOPEMENT BOARD,99fc44bf-3a5d-5cf2-bb48-d634310e7de8,Burera,8,lead,"Natural Sciences, Mathematics and Statistics",600000,777134,24/08/2026,30/11/2026,active,12,12
6000000000-080010000000000000-00018,65c0e024-c78f-513e-b20d-0c50918e0b29,"Director of Planning, Monitoring and Evaluation",RUTSIRO District,19087e75-e078-5bad-9dcc-999331552532,Rutsiro,3,mid,"Business, Administration and Law",475000,592897,22/09/2026,16/03/2027,active,552,552
1903000000-150103030000000000-00210,47345b8f-4a61-5559-bdb0-e164ca72a1fa,IT Business & Security Specialist,RWANDA INFORMATION SOCIETY AUTHORITY,9bb84a42-8cd4-5d59-80cf-5b9583db52fa,Rusizi,3,mid,"Business, Administration and Law",475000,599252,26/06/2026,21/02/2027,active,747,747
2500000000-101901000000000000-00078,6a562273-34b6-580e-917c-8b72e1902ba2,Relief Management Specialist,Ministry in charge of Emergency Management,89ef17e7-ce34-5e50-93b4-b34fe9fb998c,Ngoma,3,mid,"Business, Administration and Law",475000,624606,07/06/2026,06/09/2026,active,212,212
5500000000-801103010200000000-00082,eb9b6448-3c6f-5ee8-929b-5b0311c992f3,Secretary to Finance Unit-NYABIHU District,NYABIHU DISTRICT,3072086c-23c7-5d94-ab83-8a26850e0780,Rutsiro,0,entry,"Business, Administration and Law",220000,288074,11/10/2026,02/05/2027,active,922,922
4000003001-201029000000000000-00014,9b737bf9-c032-5071-b75b-858ffc9634ab,Social Worker A2,NGOMA DISTRICT,2cba1cd1-01b2-585b-a41f-40719659af36,Ngoma,0,entry,Health and Welfare (Health and Medical Sciences),220000,274021,11/06/2026,28/12/2026,active,450,450
6300000000-801301010000000000-00326,12a8c216-579d-5123-ba61-03cf3e045421,Logistics Officer Under Contact,MUSANZE DISTRICT,429cf6c7-e319-5db8-b32d-d396baa1f819,Musanze,0,entry,"Business, Administration and Law",220000,282781,13/10/2026,26/05/2027,active,999,999
7000000000-801203060200000000-00288,a806aba0-67b5-5e86-b339-dada896bea52,"Special groups, Gender and Family promotion Specialist",CITY OF KIGALI,b483bb3a-2b51-5e1c-9ff4-3e206ca73582,Rubavu,3,mid,Health and Welfare (Health and Medical Sciences),475000,609577,15/07/2026,28/11/2026,active,638,638
1606000000-999901103100100000-00056,0b5682d4-39dd-55df-9e00-aa99285d86f0,Microbiology Testing Specialist,RWANDA FOOD AND DRUGS AUTHORITY,0ca9c11c-8d09-5737-9fd5-50da983015af,Musanze,3,mid,"Natural Sciences, Mathematics and Statistics",475000,598901,15/09/2026,24/03/2027,active,3,3
1412009000-312050110100000000-00376,e58c8acf-2fe9-59be-92a8-e2a903edf866,Lecturer  in Automation Technology,RP MUSANZE COLLEGE,989442ff-65f9-5a8f-b7be-b738789db8ba,Musanze,0,entry,"Engineering, Manufacturing and Construction",220000,262770,03/09/2026,22/01/2027,active,0,0
1202000000-901102050000000000-00004,be6f8c04-b9c3-5693-99cb-4d918946d250,Training Centre Operations Management Specialist,NATIONAL INSTITUTE OF STATISTICS OF RWANDA,009cd6a6-c7db-581a-b467-7926ca0b28a1,Nyagatare,5,senior,"Business, Administration and Law",525000,655058,15/06/2026,12/01/2027,active,41,41
5100000000-801111000000000000-00384,3008f8dc-fcf5-5302-8745-61ecb787f9b4,Forest Extensionist,KAMONYI DISTRICT,30d0d5e5-7597-5c8c-a2fc-475f3f56cf79,Nyagatare,0,entry,"Agriculture, Forestry, Fisheries and Veterinary",220000,304628,12/08/2026,03/12/2026,active,548,548
5800003001-020000000200000000-00025,69f34143-76dc-5388-90b4-1fc94f5d0a4c,Customer Care Officer,NGORORERO DISTRICT,03e7a4e2-5073-53f7-bef5-778974608c8a,Karongi,0,entry,"Business, Administration and Law",220000,279035,17/07/2026,26/10/2026,active,199,199
5000003001-020000000100000000-00214,459ac867-2eaf-51fb-9cf6-33cb25620d2d,Accountant,MUHANGA DISTRICT,36d554e4-6fbb-53ca-aae7-53010481a5f7,Muhanga,0,entry,"Business, Administration and Law",220000,284492,25/08/2026,12/01/2027,active,1580,1580
6200000000-801101050000000000-00077,1d6a0b99-70b3-5b28-bb66-a9d91f01fd64,Business Development and Employment Promotion Officer,GICUMBI DISTRICT,afc9e29c-6db0-54ae-91bc-4cb20c590c45,Gicumbi,0,entry,"Business, Administration and Law",220000,287420,26/08/2026,21/01/2027,active,1165,1165
4400003001-201011010000000000-00030,c6789827-3232-5956-ac85-1fb839d7f61e,Clinical Psychologist(not on structure),KIREHE District,3fcb36e2-946d-5fa4-8f12-4daf1e0ee358,Muhanga,0,entry,Health and Welfare (Health and Medical Sciences),220000,267405,15/08/2026,08/01/2027,active,1,1
1419006000-301100000000000000-00012,3edc65f6-13e0-5c91-95a3-736e527444c4,"Planning, M&E Specialist",RP KARONGI COLLEGE,6861b2b1-11ae-5a1d-a69c-5e01e97eefd0,Karongi,3,mid,"Business, Administration and Law",475000,600021,25/10/2026,31/01/2027,active,1752,1752
1412001000-301205040000000000-00083,869dac8f-0470-5baf-b4eb-dbc8f6c68375,Tutorial assistant in Kinyarwanda,RP KIGALI COLLEGE,98dd66ee-6500-5d25-ae65-e5c8c8b7e2ca,Gicumbi,3,mid,Education,475000,603611,09/10/2026,10/03/2027,active,259,259
1417000000-301101160904000000-02123,160d7a81-5c8c-5040-bcb9-3d6f508215f8,IT Lab Technician  - Nyarugenge Campus,UNIVERSITY OF RWANDA,b48f5840-b3ad-581e-977f-655b68b83732,Kayonza,0,entry,"Natural Sciences, Mathematics and Statistics",220000,290193,24/08/2026,16/01/2027,active,464,464
5500000000-801103050000000000-00053,5bd9a551-e3fa-516c-ad3b-d73a59a88eef,Itorero Coordination Program and Community Mobilisation Officer,NYABIHU DISTRICT,3072086c-23c7-5d94-ab83-8a26850e0780,Muhanga,0,entry,"Business, Administration and Law",220000,288635,06/07/2026,03/11/2026,active,490,490
2205000000-140000000000000000-00067,24a2906f-35f8-5161-8ce6-1913bf3c3495,Mineral Certification Officer,"Rwanda Mines,petroleum And Gas Board",1d3e4db1-00f0-5eca-8451-c3f669797a62,Rusizi,0,entry,"Business, Administration and Law",220000,270757,01/07/2026,19/02/2027,active,186,186
5700003001-212100000000000000-00015,2552b358-bff6-503d-84cf-a9d74582534d,Head of Social Services A0,KARONGI District,850a9fe3-e6e6-5af6-a956-e50c7dad50c9,Karongi,0,entry,Health and Welfare (Health and Medical Sciences),220000,290789,23/06/2026,20/11/2026,active,455,455
5700003001-202011000000000000-00109,4b1242c6-a36d-5c9a-b037-40b94912f4c8,"Nurse, Head of Department/Matron A0",KARONGI District,850a9fe3-e6e6-5af6-a956-e50c7dad50c9,Karongi,0,entry,Health and Welfare (Health and Medical Sciences),220000,291355,11/08/2026,10/01/2027,active,122,122
6300003001-201013000000000000-00001,89b9388a-62f2-52c2-8564-ca6c0894372f,Director of lsange One Stop Center Unit,MUSANZE DISTRICT,429cf6c7-e319-5db8-b32d-d396baa1f819,Musanze,3,mid,"Business, Administration and Law",475000,569965,09/10/2026,30/01/2027,active,473,473
4200000000-801104010100000000-00085,0d76406f-78e4-5e61-886a-c7be6d9e6663,Documentation and Archives Officer,GATSIBO DISTRICT,a49ac88d-1113-5354-91a2-c95d6f247102,Gakenke,0,entry,"Natural Sciences, Mathematics and Statistics",220000,299334,19/10/2026,02/03/2027,active,16,16
0901000000-140501060000000000-00191,b9fc0254-4bb0-5684-a7fc-4bbb3805fa33,Coffee  Breeder Assistant Research Fellow,RWANDA AGRICULTURE AND ANIMAL RESOURCES DEVELOPEMENT BOARD,99fc44bf-3a5d-5cf2-bb48-d634310e7de8,Bugesera,0,entry,"Natural Sciences, Mathematics and Statistics",220000,260340,04/07/2026,05/10/2026,active,12,12
0901000000-140202080000000000-00058,b0dc83d3-2bae-5e3d-8f50-51d1913c6f28,Station Manager,RWANDA AGRICULTURE AND ANIMAL RESOURCES DEVELOPEMENT BOARD,99fc44bf-3a5d-5cf2-bb48-d634310e7de8,Gakenke,3,mid,"Business, Administration and Law",475000,656740,16/07/2026,16/10/2026,active,0,0
5500000000-801103120000000000-00320,c4d23c60-6561-5103-96e8-30a511c31107,Civil Registration and Notary,NYABIHU DISTRICT,3072086c-23c7-5d94-ab83-8a26850e0780,Gakenke,0,entry,"Business, Administration and Law",220000,270503,01/06/2026,02/10/2026,active,222,222
1601000000-201010240000000000-00101,6f169fc9-89f1-53ec-a256-b1cc44b85757,Infrastructure Mantenance Technician,CENTRAL UNIVERSITY HOSPITAL OF KIGALI,29616e3e-5b8f-597b-9988-05cd7dd37c14,Kayonza,0,entry,"Engineering, Manufacturing and Construction",220000,304648,06/10/2026,08/03/2027,active,227,227
4000003001-222104000000000000-00130,45bacd15-6026-5e25-8794-8ca866c37345,Cashier A2 Under Contarct,NGOMA DISTRICT,2cba1cd1-01b2-585b-a41f-40719659af36,Ngoma,0,entry,"Business, Administration and Law",220000,281843,13/06/2026,15/11/2026,active,966,966
1417000000-301101080901000000-03282,7eef23d7-2755-5b44-847a-a9d92deedced,Tutorial assistant Department of Veterinary Medicine- CAVM/Under contract,UNIVERSITY OF RWANDA,b48f5840-b3ad-581e-977f-655b68b83732,Huye,0,entry,Health and Welfare (Health and Medical Sciences),220000,278519,20/10/2026,20/05/2027,active,84,84
5200000000-801104150000000000-00088,c16db316-6d30-5c10-a330-6a8bdf2a4297,Secretary and Customer Care,NYANZA DISTRICT,59f60bc1-38a0-554a-8be5-c603b26aa28b,Gasabo,0,entry,"Business, Administration and Law",220000,268927,12/09/2026,13/12/2026,active,633,633
0901000000-140000000000000000-00128,6114cc96-9253-5654-9968-9bba5f974cf0,Biometrics Associate Research Fellow,RWANDA AGRICULTURE AND ANIMAL RESOURCES DEVELOPEMENT BOARD,99fc44bf-3a5d-5cf2-bb48-d634310e7de8,Kicukiro,3,mid,"Business, Administration and Law",475000,610392,29/09/2026,30/01/2027,active,9,9
1419010000-301207000000000000-00080,d9930545-7035-59c6-8996-8d1320c88458,Tutorial Assistant in Tourism,RP KITABI COLLEGE,40e23b58-8058-58f4-b61c-dfdb9c96bed7,Rwamagana,3,mid,"Business, Administration and Law",475000,654950,06/08/2026,27/03/2027,active,27,27
5000003001-210010000000000000-00017,371cfa22-7577-518d-856e-fc232cb81643,Data Manager and Statistician,MUHANGA DISTRICT,36d554e4-6fbb-53ca-aae7-53010481a5f7,Muhanga,0,entry,"Natural Sciences, Mathematics and Statistics",220000,296747,14/08/2026,13/11/2026,active,544,544
6200000000-801101050100000000-00324,2a40d2ea-a51c-573e-a216-876327c00a1e,Socio-Economic Development Officer,GICUMBI DISTRICT,afc9e29c-6db0-54ae-91bc-4cb20c590c45,Gicumbi,0,entry,Education,220000,294898,16/09/2026,06/01/2027,active,5891,5891
1417000000-301101110600000000-00424,1678b04a-31c5-53ce-96af-f03bb49aea71,Lab Technician in the School of Dentistry  School of Public Health- CMHS,UNIVERSITY OF RWANDA,b48f5840-b3ad-581e-977f-655b68b83732,Muhanga,0,entry,"Natural Sciences, Mathematics and Statistics",220000,275879,19/09/2026,24/12/2026,active,525,525
4400000000-802800000000000000-00309,46555056-f4ba-5ec4-b2ea-c91c7f5b8b74,Finance and Administration Officer,KIREHE District,3fcb36e2-946d-5fa4-8f12-4daf1e0ee358,Karongi,0,entry,"Business, Administration and Law",220000,263592,28/08/2026,16/12/2026,active,1446,1446
5500003001-020000000100000000-00049,fd045b27-68f7-5e59-b9fd-82281f42a6a3,Cashier A2,NYABIHU DISTRICT,3072086c-23c7-5d94-ab83-8a26850e0780,Burera,0,entry,"Business, Administration and Law",220000,292425,03/06/2026,29/01/2027,active,1488,1488
0302000000-060200000000000000-00008,ecb010b0-8d00-57b5-9a08-f1d8f7d46cde,HRM Policies & Regulations Compliance Specialist,NATIONAL PUBLIC SERVICE COMMISSION,d7ad4463-4b94-51eb-bd41-130265091cdd,Gasabo,3,mid,"Business, Administration and Law",475000,609683,11/09/2026,19/02/2027,active,6,6
5400003001-210010000000000000-00004,9d1549cf-4d6b-5395-80d7-cf761b928255,"Planning, M&E Officer",RUSIZI DISTRICT,ccdd88e7-36d4-5f77-8419-148f566e219f,Rusizi,0,entry,"Business, Administration and Law",220000,294914,06/06/2026,10/01/2027,active,970,970
0901000000-140501050000000000-00223,3d4cfee5-55b7-55da-a2e1-63943e87ba4b,Horticulture  Innovation and Technology Transfer Research Technician Grade IV,RWANDA AGRICULTURE AND ANIMAL RESOURCES DEVELOPEMENT BOARD,99fc44bf-3a5d-5cf2-bb48-d634310e7de8,Bugesera,3,mid,"Natural Sciences, Mathematics and Statistics",475000,586447,25/06/2026,17/12/2026,active,177,177
1412009000-312060000000000000-00362,aba2a7d3-1eb1-5524-8568-41844b7b55a4,Workshop assistant in Masonry,RP MUSANZE COLLEGE,989442ff-65f9-5a8f-b7be-b738789db8ba,Musanze,0,entry,"Engineering, Manufacturing and Construction",220000,292952,02/09/2026,10/02/2027,active,550,550
1420000000-090000000000000000-00104,761136e9-3f24-58fe-8b52-be99914a1afc,Networking and Internet Technology Teacher (A1),RWANDA TVET BOARD,445f077e-502f-5357-9104-6a4bc44ae644,Huye,0,entry,"Business, Administration and Law",220000,265764,23/08/2026,17/04/2027,active,2279,2279
4600000000-801101190000000000-00068,818e05da-09c3-58f8-8186-5a8843e3b03c,Accountant,RWAMAGANA DISTRICT,c3234125-c1c3-52c4-bec2-cfb7c4453587,Rwamagana,0,entry,"Business, Administration and Law",220000,293201,03/06/2026,04/12/2026,active,1183,1183
6400000000-308811010700000000-00098,7de1d39e-db12-566f-93e8-aaf92ef78c56,Transit center coordinator,RULINDO DISTRICT,32c88a44-7bc5-50d7-8d85-9b6ba845ba1d,Rubavu,2,mid,Education,450000,595812,22/07/2026,14/02/2027,active,64,64
2903000000-902001000000000000-00054,1a7bb4e2-e7e4-5861-b09b-1ba0fd991930,Forest Specialist,RWANDA FORESTRY AUTHORITY,db8947ee-6112-5748-b14c-a84efb32d51e,Burera,3,mid,"Agriculture, Forestry, Fisheries and Veterinary",475000,561017,13/08/2026,03/02/2027,active,340,340
1413000000-901050000000000000-00127,816c83c2-c1aa-5a48-a3a6-6d2c0fb55d46,Mathematics teacher A1,RWANDA BASIC EDUCATION BOARD,095aeb11-7497-50e3-9448-15f9a12a6d07,Burera,0,entry,Education,220000,258640,06/09/2026,08/12/2026,active,115,115
5600000000-801302000000000000-00073,6fdecade-ba30-5192-aa0d-d33246334e59,Health and Sanitation Officer,RUBAVU DISTRICT,2e4a68ad-17b3-52cb-8477-bdcc3192a60e,Rubavu,0,entry,"Natural Sciences, Mathematics and Statistics",220000,270381,24/06/2026,08/01/2027,active,529,529
1500000000-101500000000000000-00039,02514991-3ccd-5418-8eee-7cc41be5bd3a,Events Organization and Management Specialist,Ministry of Sports,9831ad06-f61e-56c4-a943-a5d244f4b6ae,Ngoma,1,entry,"Business, Administration and Law",425000,565534,21/08/2026,18/03/2027,active,731,731
5700000000-080101010200000000-00038,fc6812c7-2f3a-5285-a034-1e3856de89ae,Land Valuattion Officer,KARONGI District,850a9fe3-e6e6-5af6-a956-e50c7dad50c9,Karongi,0,entry,"Business, Administration and Law",220000,305516,22/10/2026,17/05/2027,active,1665,1665
4800000000-801103210000000000-00070,f6859aea-86a3-52f9-8034-aaa0f69073de,Animal Resources Officer,NYAMAGABE DISTRICT,15da6450-8593-5e88-bf88-24a301190e36,Nyamagabe,0,entry,"Natural Sciences, Mathematics and Statistics",220000,260329,07/07/2026,04/02/2027,active,32,32
5200003001-020000000100000000-00030,6f4e7282-6306-54bf-b183-0766ed2462b5,Head of Lab A0,NYANZA DISTRICT,59f60bc1-38a0-554a-8be5-c603b26aa28b,Rusizi,0,entry,Health and Welfare (Health and Medical Sciences),220000,266106,15/10/2026,09/04/2027,active,112,112
5200003001-201200000000000000-00008,ab22c8e4-1881-5da8-9fd0-447820ec0ca0,Infrastructure Maintenance Officer A1/A0,NYANZA DISTRICT,59f60bc1-38a0-554a-8be5-c603b26aa28b,Nyarugenge,0,entry,"Engineering, Manufacturing and Construction",220000,290952,24/08/2026,12/02/2027,active,412,412
1400000000-101105000000000000-00029,31a86772-5b0a-5831-badb-57e193c33456,Human Resource Specialist,Ministry of Education,22bcc10b-e8c4-5b9e-9294-54c41b569b8b,Gicumbi,3,mid,"Business, Administration and Law",475000,595432,28/09/2026,25/04/2027,active,30,30
1804000000-902104000000000000-00007,9e68bb9b-46c1-5189-8c24-edd1a37fd624,Complex Building Senior Mechanical Engineer,RWANDA HOUSING AUTHORITY,56d2f24d-b50d-5a99-94e4-02af46b5acaf,Gakenke,5,senior,"Engineering, Manufacturing and Construction",525000,621111,10/06/2026,07/01/2027,active,49,49
5900003001-020000000300000000-00013,b0c90ff8-a6fa-57e5-a6f1-e49e97bef637,Cashier A2,NYAMASHEKE DISTRICT,df7f48ff-d7a0-5e14-bcac-b031721cb870,Nyamasheke,0,entry,"Business, Administration and Law",220000,267699,19/06/2026,28/11/2026,active,3775,3775
1417000000-301101070501000000-02532,eb2a1f6d-6cc4-5882-ad34-e5d8388b11e0,"Assistant Lecturer  School of Arts, Languages and communication studies- CASS",UNIVERSITY OF RWANDA,b48f5840-b3ad-581e-977f-655b68b83732,Gakenke,2,mid,"Natural Sciences, Mathematics and Statistics",450000,532326,15/09/2026,04/04/2027,active,35,35
