original_job_id,job_id,title,institution,company_id,location,experience_years_required,experience_level,field_of_study,salary_min,salary_max,published_at,expires_at,status,real_total_applicants,real_total_engagements
1001000000-140202010000000000-00082,2d986f39-1fd7-5d72-8489-148deb5f9de7,Construction materials products Certification Officer,RWANDA STANDARDS BOARD,2359a6c3-9b45-5036-9b52-03c3fd918bfc,Huye,0,entry,"Engineering, Manufacturing and Construction",220000,258699,15/10/2026,13/04/2027,active,439,439
4100003001-203000000000000000-00003,b9ea0e24-1a48-573d-999e-fab533f31007,Cashier A2,BUGESERA DISTRICT,c8a4c97f-7988-5f08-822d-7183bfec5e8e,Bugesera,0,entry,"Business, Administration and Law",220000,283317,02/10/2026,22/04/2027,active,3946,3946
0108000008-400000000000000000-00001,e9a4a726-1a0d-50f4-9fb6-b39b34f38f82,Ingazi youth ambassadors,Ministry of Public Service and Labour,9278b25b-a0fc-5a7d-978b-dbf3daeb3cfa,Nyamagabe,0,entry,Education,220000,265530,30/09/2026,15/05/2027,active,498,498
7000000000-801203080200000000-00293,e140ffcf-3568-579d-abdd-24f1fbe49fad,Planning Specialist,CITY OF KIGALI,b483bb3a-2b51-5e1c-9ff4-3e206ca73582,Karongi,3,mid,"Business, Administration and Law",475000,630991,10/08/2026,02/04/2027,active,1285,1285
4500000000-801101130000000000-00075,8bd2cf3d-ea64-51fd-970a-1f611dc603de,Education Officer,NYAGATARE DISTRICT,ea57dad2-1ad5-5d85-b3e2-419c988cf789,Nyagatare,0,entry,"Natural Sciences, Mathematics and Statistics",220000,266683,14/09/2026,23/01/2027,active,1321,1321
6000000000-812100000000000000-00068,bba18610-1bbb-580e-88e1-b57648f6028e,Accountant,RUTSIRO District,19087e75-e078-5bad-9dcc-999331552532,Rutsiro,0,entry,"Business, Administration and Law",220000,263151,19/09/2026,20/02/2027,active,1084,1084
6600003001-020000002200000000-00013,0ec6d0cc-7263-5f79-b097-274bca23fbdc,Legal Affairs Officer,RUHANGO DISTRICT,47f78d9e-5fd5-57bf-aa7f-abb47fe487df,Rubavu,0,entry,"Business, Administration and Law",220000,305564,24/10/2026,15/06/2027,active,39,39
4700003001-201010000000000000-00023,0d25165b-6993-5905-960c-82092690df2b,"Planning, Monitoring and Evaluation Officer",HUYE DISTRICT,8389d518-a63f-5b73-b6aa-59f323787365,Huye,0,entry,"Business, Administration and Law",220000,280370,17/07/2026,24/02/2027,active,768,768
6900003001-201605000000000000-00003,d8b6e0d0-b3a2-5072-b504-b3f3ec5d55c7,"Integrated  Disease Detective, Surveillance and Response Specialist",GASABO DISTRICT,0eb370b0-03ce-502d-98e9-68c3995e2b34,Gasabo,1,entry,Health and Welfare (Health and Medical Sciences),425000,522808,12/10/2026,02/02/2027,active,85,85
4200000000-801104020000000000-00035,2ff94482-5d9c-559d-90c4-1a06d46ba552,IT/MIS Officer,GATSIBO DISTRICT,a49ac88d-1113-5354-91a2-c95d6f247102,Gicumbi,0,entry,"Engineering, Manufacturing and Construction",220000,302065,14/10/2026,22/01/2027,active,202,202
5800000000-801101032702010000-00324,b672136e-ba16-5731-982f-4d0b6f19e0d1,Socio-Economic Development Officer,NGORORERO DISTRICT,03e7a4e2-5073-53f7-bef5-778974608c8a,Nyamagabe,0,entry,Education,220000,264198,18/07/2026,11/12/2026,active,3029,3029
1432000000-101104000000000000-00026,d753e3af-2ec6-5060-a07b-bbca90ee0c36,Driver,Ministry of Education,22bcc10b-e8c4-5b9e-9294-54c41b569b8b,Karongi,0,entry,"Services, Tourism and Hospitality",220000,253562,19/08/2026,08/01/2027,active,7,7
4500000000-801101240000000000-00045,fce14e80-c552-5b65-86f4-97bd3b99d157,Investment Promotion and Financial Services Officer,NYAGATARE DISTRICT,ea57dad2-1ad5-5d85-b3e2-419c988cf789,Nyagatare,0,entry,"Business, Administration and Law",220000,268754,05/08/2026,12/02/2027,active,537,537
1303000000-601102000000000000-00010,1f200fcc-69f6-5f5b-ac7c-08bd9386db96,Legal Reform and Revision Specialist,Rwanda Law Reform Commission,317594ab-2f3d-5fd2-add5-77d9f0ec58b2,Kayonza,3,mid,"Business, Administration and Law",475000,637515,31/10/2026,08/02/2027,active,275,275
6200003001-201045000000000000-00041,47ff85da-863f-51e8-80f2-f00199cc23de,Cashier A2 /A1,GICUMBI DISTRICT,afc9e29c-6db0-54ae-91bc-4cb20c590c45,Gicumbi,0,entry,"Business, Administration and Law",220000,286091,21/09/2026,06/01/2027,active,2208,2208
2001000000-901103000000000000-00027,13398f72-cc42-51f4-9eb6-9a9af8ef8301,IT Systems & Network Administrator,Rwanda Management Institute,f7c407b6-cb3a-57e5-97dc-abfc35a84413,Burera,2,mid,"Natural Sciences, Mathematics and Statistics",450000,521459,24/10/2026,21/02/2027,active,25,25
3200000000-101103000000000000-00016,85bee962-4d6d-5b42-aa79-052752da24bb,Asset Valuation Specialist,Ministry of Public Investments and Privatization,09037bcf-d828-50d4-8301-991fda242c53,Karongi,3,mid,"Business, Administration and Law",475000,634125,15/07/2026,20/01/2027,active,1154,1154
1602000000-201305000000000000-00121,574852c5-cef6-5e2f-9068-3da2936065e3,Senior archives Officer,CENTRAL UNIVERSITY HOSPITAL OF BUTARE,1cc90452-1205-5182-b85d-1874e4c0b5aa,Burera,0,entry,"Business, Administration and Law",220000,263503,14/10/2026,05/03/2027,active,59,59
1500000000-101101000000000000-00035,66210f86-d5a5-554a-add6-a5ac37139072,Accountant,Ministry of Sports,9831ad06-f61e-56c4-a943-a5d244f4b6ae,Musanze,0,entry,"Business, Administration and Law",220000,291168,11/10/2026,29/04/2027,active,106,106
2800000000-101000000000000000-00027,5c19cbcb-e7b5-5e9b-a039-b6b1721fa43d,Senior Technologist Content & Media,Ministry of ICT and Innovation,a5e607e2-6d6d-5289-a081-0821a1834dc3,Rubavu,3,mid,"Business, Administration and Law",475000,564134,24/06/2026,11/12/2026,active,1057,1057
6100003001-227407010000000000-00001,6fd69870-e5a1-55d8-be00-ab45cdc55762,Director of Medical Services Unit,BURERA DISTRICT,c4128617-4671-5d0c-90db-21350d0dfb04,Burera,1,entry,Health and Welfare (Health and Medical Sciences),425000,589198,11/08/2026,11/01/2027,active,0,0
5200000000-801104010000000000-00029,8ffe59eb-7a0f-587a-a67c-e923e20bec6f,Accountant,NYANZA DISTRICT,59f60bc1-38a0-554a-8be5-c603b26aa28b,Nyamasheke,0,entry,"Business, Administration and Law",220000,263842,09/09/2026,15/01/2027,active,1874,1874
4000003001-201025000000000000-00014,400581bf-8dfe-5f37-a3d0-f20ae25758aa,Driver Under Contract,NGOMA DISTRICT,2cba1cd1-01b2-585b-a41f-40719659af36,Ngoma,0,entry,"Services, Tourism and Hospitality",220000,307730,26/08/2026,04/12/2026,active,3457,3457
1001000000-140201040000000000-00140,1d4729cc-fee8-5fcc-b7ae-36364b58df80,"Director of Standards Publication, Training and Technical Assistance Unit",RWANDA STANDARDS BOARD,2359a6c3-9b45-5036-9b52-03c3fd918bfc,Karongi,3,mid,"Business, Administration and Law",475000,604298,04/07/2026,29/12/2026,active,364,364
1000001000-101000000000000000-00004,e7bf638a-d0e3-51f4-9c1f-b86f62653455,Financial Management Specialist,Ministry of Trade and Industry,681ca0ab-1c89-5862-994f-4cb0a2998110,Muhanga,3,mid,"Business, Administration and Law",475000,639603,10/07/2026,06/03/2027,active,632,632
5100003001-020000000000000000-00063,c0a41bc2-da28-58c6-86a8-8b458b52a30a,Cashier A2,KAMONYI DISTRICT,30d0d5e5-7597-5c8c-a2fc-475f3f56cf79,Gakenke,0,entry,"Business, Administration and Law",220000,285549,18/07/2026,13/02/2027,active,1578,1578
2205000000-140203010600000000-00048,269939fc-bc39-5e3d-99a0-eb01fccb906d,Seismology Stations Technician,"Rwanda Mines,petroleum And Gas Board",1d3e4db1-00f0-5eca-8451-c3f669797a62,Gicumbi,0,entry,"Natural Sciences, Mathematics and Statistics",220000,298345,08/10/2026,20/03/2027,active,140,140
1605000440-090000000000000000-00001,0ec822c2-5d07-54d6-b068-4c11657bdb50,NTD-WASH Coordination officer,RWANDA BIO MEDICAL CENTER,fff3e870-09bd-55ae-a770-c558a61b9c12,Karongi,3,mid,"Natural Sciences, Mathematics and Statistics",475000,599780,17/06/2026,07/02/2027,active,272,272
2204000000-901501000000000000-00006,c4e0a47d-703a-5d6c-a059-c5b2f9602995,Financial Management Specialist,RWANDA METEOROLOGY AGENCY,0acf8cfa-735a-5f72-ab5b-eae1b8265c24,Rusizi,5,senior,"Business, Administration and Law",525000,605580,21/08/2026,24/02/2027,active,69,69
4600000000-801101100000000000-00073,4e1d7b0e-00f1-5fb0-b926-a04ee594af9f,Health and Sanitation Officer,RWAMAGANA DISTRICT,c3234125-c1c3-52c4-bec2-cfb7c4453587,Rwamagana,0,entry,"Natural Sciences, Mathematics and Statistics",220000,305412,16/06/2026,13/12/2026,active,593,593
0800000000-101303000000000000-00098,a1f0fde8-e801-58fa-b635-2e0cca4b1956,Administrative Assistant,Ministry of Foreign Affairs and International Cooperation,8829c2b2-9325-561d-bbf1-693a04731d39,Rubavu,0,entry,"Business, Administration and Law",220000,256471,04/09/2026,04/01/2027,active,384,384
2500001002-240200000000000000-00120,1c2e513c-dfbd-5ff1-8245-ed25893f4e91,Driver,Ministry in charge of Emergency Management,89ef17e7-ce34-5e50-93b4-b34fe9fb998c,Rutsiro,10,executive,"Services, Tourism and Hospitality",650000,830531,04/10/2026,26/05/2027,active,177,177
5900000000-801105060000000000-00124,9b4a368f-59b6-5861-9360-3d00ea5f7c62,ECD Caregiver,NYAMASHEKE DISTRICT,df7f48ff-d7a0-5e14-bcac-b031721cb870,Nyamasheke,0,entry,Education,220000,305616,02/10/2026,23/05/2027,active,4549,4549
1413000000-901050000000000000-00160,ae6fdc8e-7d23-54e4-8175-ac40afc084e7,History and Economics teacher A0,RWANDA BASIC EDUCATION BOARD,095aeb11-7497-50e3-9448-15f9a12a6d07,Rubavu,0,entry,"Business, Administration and Law",220000,277567,16/09/2026,04/01/2027,active,2188,2188
5800000000-801101030200000000-00036,cecfb646-f3f8-5b60-8711-9f63d407e5a2,Electricity Maintenance Engineer,NGORORERO DISTRICT,03e7a4e2-5073-53f7-bef5-778974608c8a,Gasabo,0,entry,"Natural Sciences, Mathematics and Statistics",220000,288548,05/09/2026,23/04/2027,active,156,156
1419010000-301102000000000000-00057,9b7a0796-012c-5ece-9b94-672532ce4772,Driver,RP KITABI COLLEGE,40e23b58-8058-58f4-b61c-dfdb9c96bed7,Bugesera,0,entry,"Services, Tourism and Hospitality",220000,275899,05/10/2026,15/04/2027,active,138,138
4000003001-201012000000000000-00037,92118474-953d-5d70-adf0-c4afaa500043,"Nurse, Head of Department/Matron A0",NGOMA DISTRICT,2cba1cd1-01b2-585b-a41f-40719659af36,Ngoma,0,entry,Health and Welfare (Health and Medical Sciences),220000,294577,07/10/2026,27/03/2027,active,130,130
1419005000-031200000000000000-00104,b7aa463d-e211-501f-a0b1-a2c00c0a7673,Administrative Assistant,RP NGOMA COLLEGE,52e7313f-4639-5d79-bad8-2615e3b7e280,Ngoma,0,entry,"Business, Administration and Law",220000,273586,02/06/2026,11/11/2026,active,242,242
1605000746-090000000000000000-00014,94405ea8-85f4-5072-b001-af0c321f41b8,Data Management Officer - South,RWANDA BIO MEDICAL CENTER,fff3e870-09bd-55ae-a770-c558a61b9c12,Gicumbi,3,mid,"Natural Sciences, Mathematics and Statistics",475000,589111,24/10/2026,08/04/2027,active,265,265
4600000000-801101010300000000-00022,e487a677-a5e4-5751-bf43-82f04f366f42,"Planning, M& E Officer",RWAMAGANA DISTRICT,c3234125-c1c3-52c4-bec2-cfb7c4453587,Rwamagana,0,entry,"Business, Administration and Law",220000,258899,13/08/2026,13/01/2027,active,1849,1849
4200003001-020000000200000000-00027,f2aad3c9-979c-5409-84dd-18f433320d0c,Customer Care Officer,GATSIBO DISTRICT,a49ac88d-1113-5354-91a2-c95d6f247102,Nyamasheke,0,entry,"Business, Administration and Law",220000,267449,16/08/2026,22/11/2026,active,4,4
4700000000-801310000000000000-00073,c30bd990-db8c-5ec3-8c3b-b590c57b7cbd,Health and Sanitation Officer,HUYE DISTRICT,8389d518-a63f-5b73-b6aa-59f323787365,Huye,0,entry,"Natural Sciences, Mathematics and Statistics",220000,254644,17/06/2026,25/12/2026,active,583,583
1500000000-101400000000000000-00016,95202d82-3c5e-567e-a4e6-9dcd34714e15,Sports Infrastructure Management  Officer,Ministry of Sports,9831ad06-f61e-56c4-a943-a5d244f4b6ae,Burera,0,entry,"Natural Sciences, Mathematics and Statistics",220000,255601,22/10/2026,25/05/2027,active,299,299
4500000000-801101070000000000-00032,684e387d-ad2b-51c4-a07b-32d68fd74f09,One Stop Centre Lawyer,NYAGATARE DISTRICT,ea57dad2-1ad5-5d85-b3e2-419c988cf789,Nyagatare,0,entry,"Business, Administration and Law",220000,301662,19/09/2026,09/01/2027,active,1,1
2206000000-090301010100000000-00055,5543858c-c38a-5785-af81-085888566060,Water Resources Planner,NATIONAL LAND AUTHORITY,d5d4f331-8023-54d0-9e47-45ac59d2786d,Nyamasheke,1,entry,"Natural Sciences, Mathematics and Statistics",425000,515813,11/06/2026,20/01/2027,active,100,100
1800000000-101103000000000000-00001,be593bbd-7b19-5076-9e98-707e14b02a3d,Secretary to Finance,Ministry of Infrastructure,02256b11-7514-502e-85c5-4b5ed28c00b5,Kayonza,0,entry,"Business, Administration and Law",220000,280236,19/07/2026,17/10/2026,active,98,98
0901000000-140601010000000000-00143,24e84661-277b-51c0-8e39-9642dddced26,Pigs and Rabbits Nutrition and Production System Associate Research Fellow,RWANDA AGRICULTURE AND ANIMAL RESOURCES DEVELOPEMENT BOARD,99fc44bf-3a5d-5cf2-bb48-d634310e7de8,Nyamagabe,3,mid,"Natural Sciences, Mathematics and Statistics",475000,571003,03/06/2026,16/11/2026,active,10,10
6400003001-021400000000000000-00012,29f16182-28fc-5f8f-b3b7-d2d6491acde9,Human Resource Officer,RULINDO DISTRICT,32c88a44-7bc5-50d7-8d85-9b6ba845ba1d,Nyarugenge,0,entry,"Business, Administration and Law",220000,292835,04/08/2026,21/03/2027,active,558,558
6200000000-801101230000000000-00320,36646eee-3113-5a6a-bd7a-f839a16ce8b2,Civil Registration and Notary,GICUMBI DISTRICT,afc9e29c-6db0-54ae-91bc-4cb20c590c45,Gicumbi,0,entry,"Business, Administration and Law",220000,274349,27/09/2026,06/03/2027,active,260,260
0800000000-101701000000000000-00094,1c769819-5190-59a0-982d-3a885a502f2d,Administrative to the Ambassador at large in charge of African Integration,Ministry of Foreign Affairs and International Cooperation,8829c2b2-9325-561d-bbf1-693a04731d39,Musanze,0,entry,"Business, Administration and Law",220000,300606,12/06/2026,26/11/2026,active,363,363
4800000000-801103010100000000-00007,57e02d4f-c6b6-57de-b99f-3f0eed2c9f53,Director of Human Resources and Administration,NYAMAGABE DISTRICT,15da6450-8593-5e88-bf88-24a301190e36,Nyamagabe,3,mid,"Business, Administration and Law",475000,588720,17/06/2026,07/10/2026,active,96,96
4500003001-020000000300000000-00001,08877b86-a84e-5753-8961-f463afc12ccb,Health Center Manager A0/A1,NYAGATARE DISTRICT,ea57dad2-1ad5-5d85-b3e2-419c988cf789,Nyagatare,5,senior,"Natural Sciences, Mathematics and Statistics",525000,670713,09/09/2026,10/12/2026,active,52,52
2700000001-101100000000000000-00003,2e28ea5e-61bf-5764-ab12-e395a828af4a,Lab Technician at District Level,MINISTRY OF YOUTH AND ARTS,11d0986b-ce1b-5ee5-96a1-273f38f93021,Kayonza,1,entry,Health and Welfare (Health and Medical Sciences),425000,506252,18/06/2026,16/01/2027,active,18,18
4000000000-801102230000000000-00066,dafa301a-813c-5c1f-9b11-33ddb93a6bdf,Finance and Administration Officer,NGOMA DISTRICT,2cba1cd1-01b2-585b-a41f-40719659af36,Ngoma,0,entry,"Business, Administration and Law",220000,268819,11/07/2026,09/12/2026,active,1111,1111
1600000000-111101110010000000-00027,d8b19b4d-453e-5cfc-aae3-a5b0f6b8ffd8,Public Health Emergency Coordination Specialist,Ministry of Health,569d7a80-d68b-525d-b2c7-e6a8c7d11404,Rusizi,3,mid,"Natural Sciences, Mathematics and Statistics",475000,557054,01/11/2026,25/06/2027,active,141,141
2902000000-140100000000000000-00058,0d0fe928-55e2-580f-a98a-e06472e20700,Administrative Assistant,Rwanda Water Resources Board,bc03a799-837d-5602-a105-0d3bc3efda7b,Gicumbi,0,entry,"Business, Administration and Law",220000,272881,06/07/2026,18/12/2026,active,367,367
2500001002-210100000000000000-00002,ddffd1ee-c337-52ab-996a-01f12a49fd60,Project Accountant,Ministry in charge of Emergency Management,89ef17e7-ce34-5e50-93b4-b34fe9fb998c,Huye,0,entry,"Business, Administration and Law",220000,307112,04/08/2026,03/12/2026,active,1077,1077
7000000000-801203100000000000-00311,31f57af4-db60-524c-a4ec-b964be2507d0,Building Structure Assessment Engineer,CITY OF KIGALI,b483bb3a-2b51-5e1c-9ff4-3e206ca73582,Kicukiro,0,entry,"Engineering, Manufacturing and Construction",220000,268254,01/09/2026,13/12/2026,active,2205,2205
5900000000-801105120000000000-00077,34b208af-39f8-59af-9b05-6720affd6402,Business Development and Employment Promotion Officer,NYAMASHEKE DISTRICT,df7f48ff-d7a0-5e14-bcac-b031721cb870,Nyamasheke,0,entry,Education,220000,264172,27/07/2026,07/12/2026,active,2068,2068
4400003001-201012020000000000-00163,c6431d38-78c7-5bbe-b58b-6f3f1b7f11f8,Cashier A2,KIREHE District,3fcb36e2-946d-5fa4-8f12-4daf1e0ee358,Gicumbi,0,entry,"Business, Administration and Law",220000,299600,07/09/2026,30/03/2027,active,948,948
2306000000-901201010000000000-00042,33ca0b07-c401-5235-8ae2-8578c2d9dc87,Secretary at Mutobo Demobilization center,RWANDA DEMOBILIZATION AND REINTEGRATION COMMISSION,163d42bb-aceb-596c-afd9-e2b43bb5cc68,Huye,0,entry,"Business, Administration and Law",220000,270281,05/09/2026,16/01/2027,active,594,594
6100000000-801101020000000000-00035,f2e43c02-53ad-5248-bab9-74aebae07c9b,IT/MIS Officer,BURERA DISTRICT,c4128617-4671-5d0c-90db-21350d0dfb04,Burera,0,entry,"Engineering, Manufacturing and Construction",220000,273162,05/08/2026,31/01/2027,active,145,145
5300003001-202101000000000000-00166,85a0d0cb-3be4-582b-95b0-05421d957b2e,Accountant,NYARUGURU DISTRICT,be6df96d-d4e7-5e8f-904a-ef4f3521a93b,Musanze,0,entry,"Business, Administration and Law",220000,270137,20/09/2026,28/02/2027,active,44,44
6400000000-308811011800000000-00069,59b479ef-65b9-5be1-8f97-979d4dcab4db,Agriculture and Natural Resources Officer,RULINDO DISTRICT,32c88a44-7bc5-50d7-8d85-9b6ba845ba1d,Bugesera,0,entry,"Business, Administration and Law",220000,296279,16/07/2026,22/11/2026,active,817,817
5900000000-801105070100000000-00058,17460236-99ef-522a-895d-1aff6ebcc34d,Disability Mainstreaming Officer,NYAMASHEKE DISTRICT,df7f48ff-d7a0-5e14-bcac-b031721cb870,Nyamasheke,0,entry,Education,220000,253031,11/06/2026,26/09/2026,active,366,366
1605000000-901102000000000000-00033,b18ae1f9-4ee9-5b38-9c99-e5820d29b4d8,Administrative Assistant to the Head of Biomedical Services Department,RWANDA BIO MEDICAL CENTER,fff3e870-09bd-55ae-a770-c558a61b9c12,Huye,0,entry,"Business, Administration and Law",220000,254313,14/09/2026,20/03/2027,active,280,280
7000000000-801203080000000000-00330,ee52586f-2524-5b82-acb6-292365ac805d,Administrative Liason Officer,CITY OF KIGALI,b483bb3a-2b51-5e1c-9ff4-3e206ca73582,Burera,0,entry,"Business, Administration and Law",220000,303751,15/09/2026,27/12/2026,active,21,21
1419004000-312050150100000000-00238,0e5d7d69-4385-5337-aa69-28ea1ad3aa65,Lecture in Animal Heath,RP HUYE COLLEGE,81a1dad5-202f-5060-bf35-06a535fa2045,Huye,5,senior,"Business, Administration and Law",525000,670622,22/10/2026,30/03/2027,active,5,5
1601000000-201030000000000000-00005,5c3e926f-ccac-5a5e-9b32-a23382d34c4a,Fleet Management Officer,CENTRAL UNIVERSITY HOSPITAL OF KIGALI,29616e3e-5b8f-597b-9988-05cd7dd37c14,Rusizi,0,entry,"Natural Sciences, Mathematics and Statistics",220000,258125,08/08/2026,12/12/2026,active,193,193
1419005000-312063000000000000-00145,b0279fad-8f9a-5bc4-9a88-22e58dcd12ff,Lecturer in Automobile Technology,RP NGOMA COLLEGE,52e7313f-4639-5d79-bad8-2615e3b7e280,Ngoma,3,mid,"Engineering, Manufacturing and Construction",475000,559815,28/09/2026,07/02/2027,active,4,4
1603000000-201802000000000000-00007,237c78df-b0f2-51a6-b6bd-6a4cfbe24106,Logistics Officer,NEURO PSYCHIATRIC TEACHING HOSPITAL CARAES NDERA,cbdc2732-c253-5564-aa7f-c104f4d6409f,Rutsiro,0,entry,"Business, Administration and Law",220000,255820,09/10/2026,24/03/2027,active,49,49
4700003001-201010000000000000-00006,e76a2c4e-98eb-5f57-99db-59842a3bf02b,Quality Improvement Officer,HUYE DISTRICT,8389d518-a63f-5b73-b6aa-59f323787365,Huye,0,entry,"Business, Administration and Law",220000,275325,17/06/2026,04/12/2026,active,227,227
6000003001-020000001600000000-00002,d7ff3840-9354-5f9b-b760-f25f4660954e,Cashier A2,RUTSIRO District,19087e75-e078-5bad-9dcc-999331552532,Rutsiro,0,entry,"Business, Administration and Law",220000,296790,22/06/2026,15/10/2026,active,441,441
2701000000-901202000000000000-00019,836e6d93-4f76-55a3-ae48-406870818b6c,Museum Management Specialist,RWANDA CULTURAL HERITAGE ACADEMY,38eee470-33b6-5762-b22e-90e46dbfbd16,Gicumbi,3,mid,"Business, Administration and Law",475000,652775,11/06/2026,09/09/2026,active,28,28
5400003001-211000000000000000-00014,26f3ce47-a7df-5623-b8e0-9e2cc3354a2b,Quality Improvement Officer,RUSIZI DISTRICT,ccdd88e7-36d4-5f77-8419-148f566e219f,Rusizi,0,entry,Health and Welfare (Health and Medical Sciences),220000,269851,30/09/2026,23/04/2027,active,16,16
6000000000-812301012303000000-00324,86bde719-bb7c-564c-b962-876ef8d90dcf,Socio-Economic Development Officer,RUTSIRO District,19087e75-e078-5bad-9dcc-999331552532,Rutsiro,0,entry,Education,220000,289754,20/09/2026,02/04/2027,active,8442,8442
5900003001-020000000800000000-00014,be6fcd6e-fbc5-5c4d-9531-89bac3c7d8aa,Social Worker A2,NYAMASHEKE DISTRICT,df7f48ff-d7a0-5e14-bcac-b031721cb870,Nyamasheke,0,entry,Health and Welfare (Health and Medical Sciences),220000,305485,24/10/2026,10/03/2027,active,318,318
1412009000-301202000000000000-00031,3611b7d8-6f8a-579f-b846-25b403937723,Admission & Registration Officer,RP MUSANZE COLLEGE,989442ff-65f9-5a8f-b7be-b738789db8ba,Musanze,3,mid,Education,475000,624466,25/07/2026,29/11/2026,active,632,632
1417000000-301101090103000000-01075,069e68f5-9698-5ee3-bc59-b0f37f0297b5,Network Administrator  Rukara Campus- Rukara Campus,UNIVERSITY OF RWANDA,b48f5840-b3ad-581e-977f-655b68b83732,Karongi,0,entry,"Natural Sciences, Mathematics and Statistics",220000,299869,28/07/2026,18/02/2027,active,566,566
1417000000-301101090105000000-02291,266f6202-db9f-59fa-9446-4282ae249d49,Health & Safety Officer   Rukara Campus- Rukara Campus,UNIVERSITY OF RWANDA,b48f5840-b3ad-581e-977f-655b68b83732,Gicumbi,0,entry,"Natural Sciences, Mathematics and Statistics",220000,283379,06/10/2026,01/06/2027,active,0,0
1804000000-090102000000000000-00038,191385f7-c32f-5161-b888-77b60db27963,Building Quality Assurance  Specialist,RWANDA HOUSING AUTHORITY,56d2f24d-b50d-5a99-94e4-02af46b5acaf,Rubavu,3,mid,"Engineering, Manufacturing and Construction",475000,583002,23/07/2026,01/12/2026,active,120,120
2201001001-901300000000000000-00003,bca05af5-8fbf-5dc7-b2d3-7adc390b8ffd,Ecosystem Recovery & Pollution Management Program Manager,RWANDA ENVIRONMENT MANAGEMENT AUTHORITY,42d71c20-d5d9-5490-ab5d-33c95b2de8c7,Musanze,5,senior,"Natural Sciences, Mathematics and Statistics",525000,675321,24/06/2026,21/12/2026,active,1,1
1412002000-312063000000000000-00271,485906a9-2942-552a-8af0-b6022a34edb7,LAB assistant  in Simulation & Modeling LAB,RP TUMBA COLLEGE,b4ac750b-a2c8-509c-a7d2-ba186be70088,Rutsiro,0,entry,Information and Communication Technologies (ICTs),220000,274300,18/06/2026,13/11/2026,active,40,40
6600003001-020000002200000000-00004,cc85af58-4da1-530c-8732-fecefc824512,"Planning, M&E Officer",RUHANGO DISTRICT,47f78d9e-5fd5-57bf-aa7f-abb47fe487df,Nyamagabe,0,entry,"Business, Administration and Law",220000,282539,01/07/2026,07/10/2026,active,59,59
4500000000-801101210000000000-00066,8923fda5-fa93-50b8-9be2-9e529cf895c4,Finance and Administration Officer,NYAGATARE DISTRICT,ea57dad2-1ad5-5d85-b3e2-419c988cf789,Nyagatare,0,entry,"Business, Administration and Law",220000,285975,24/06/2026,27/10/2026,active,39,39
7000000000-801201010000000000-00343,4ad3d51f-7480-54b2-a8c3-6477a0a71fb1,Advisor to the Executive Organ,CITY OF KIGALI,b483bb3a-2b51-5e1c-9ff4-3e206ca73582,Huye,3,mid,"Business, Administration and Law",475000,583287,16/08/2026,09/12/2026,active,3,3
6600003001-216001000000000000-00146,dd44e20c-2f41-5469-92a7-97298c148925,Social Worker A2/A1,RUHANGO DISTRICT,47f78d9e-5fd5-57bf-aa7f-abb47fe487df,Gicumbi,0,entry,"Natural Sciences, Mathematics and Statistics",220000,259966,05/06/2026,01/01/2027,active,0,0
2306000000-901202000000000000-00029,78d3092f-c7b4-54db-b35d-6df420335b64,Accountant,RWANDA DEMOBILIZATION AND REINTEGRATION COMMISSION,163d42bb-aceb-596c-afd9-e2b43bb5cc68,Karongi,0,entry,"Business, Administration and Law",220000,280372,02/07/2026,15/01/2027,active,846,846
1412001000-301205020000000000-00086,25b942da-c0ef-5f91-b9dc-3235957fa991,Assistant Lecturer in Construction Technology,RP KIGALI COLLEGE,98dd66ee-6500-5d25-ae65-e5c8c8b7e2ca,Nyagatare,3,mid,"Engineering, Manufacturing and Construction",475000,570752,29/06/2026,30/09/2026,active,7,7
1605000000-901400000000000000-00164,dcd3e2b8-fedf-5e57-a17c-b7f885142dea,Anesthesiologist & Nurse,RWANDA BIO MEDICAL CENTER,fff3e870-09bd-55ae-a770-c558a61b9c12,Kicukiro,0,entry,Information and Communication Technologies (ICTs),220000,294157,27/09/2026,04/02/2027,active,1201,1201
1000000000-101104000000000000-00028,c2947be3-18e4-540f-856f-e2a89c3c8cdd,Downstream Petroleum Policy Specialist,Ministry of Trade and Industry,681ca0ab-1c89-5862-994f-4cb0a2998110,Muhanga,3,mid,"Business, Administration and Law",475000,638994,01/10/2026,24/02/2027,active,439,439
1001000000-140201020000000000-00141,ac068ed6-08b5-5f44-8400-e3fc0ef132eb,"Director of Agriculture,Chemistry and Environment Standards Unit",RWANDA STANDARDS BOARD,2359a6c3-9b45-5036-9b52-03c3fd918bfc,Gasabo,3,mid,"Natural Sciences, Mathematics and Statistics",475000,585125,06/10/2026,19/05/2027,active,427,427
1432000000-101104000000000000-00017,33d4d1a7-23e7-54f2-b233-1a9235e32581,Financial Management Specialist,Ministry of Education,22bcc10b-e8c4-5b9e-9294-54c41b569b8b,Rutsiro,3,mid,"Business, Administration and Law",475000,609482,26/08/2026,23/02/2027,active,804,804
1001000000-140201040000000000-00164,133c285b-54b4-5331-b579-d5fb2dd3e78e,Standards Training and Technical Assistance Officer in Food Safety Management System field,RWANDA STANDARDS BOARD,2359a6c3-9b45-5036-9b52-03c3fd918bfc,Gasabo,0,entry,Education,220000,259615,10/06/2026,12/11/2026,active,400,400
2313000000-901100000000000000-00010,901a8cd5-383a-556a-baa9-1420150946c8,M&E Officer,NATIONAL IDENTIFICATION AGENCY,e6d8f53d-50ab-5bba-b997-4a5850719b44,Kayonza,0,entry,"Business, Administration and Law",220000,303864,26/06/2026,16/10/2026,active,1007,1007
